studyID,pubMedID,citation,studyScore,ethnicity,cohort,title,lastUpdated
GCST003261,26708676,Pulit SL 2015,22.9,European|African American or Afro-Caribbean|African unspecified|East Asian|Hispanic or Latin American,306225,Loci associated with ischaemic stroke and its subtypes (SiGN): a genome-wide association study.,5/8/2020
GCST003268,26626624,Stuart PE 2015,5.75,European,30742,Genome-wide Association Analysis of Psoriatic Arthritis and Cutaneous Psoriasis Reveals Differences in Their Genetic Architecture.,5/8/2020
GCST003269,26626624,Stuart PE 2015,5.75,European,23650,Genome-wide Association Analysis of Psoriatic Arthritis and Cutaneous Psoriasis Reveals Differences in Their Genetic Architecture.,5/8/2020
GCST003270,26626624,Stuart PE 2015,5.75,European,23942,Genome-wide Association Analysis of Psoriatic Arthritis and Cutaneous Psoriasis Reveals Differences in Their Genetic Architecture.,5/8/2020
GCST003279,27179730,Allen NB 2016,3.75,European,12230,Genetic loci associated with ideal cardiovascular health: A meta-analysis of genome-wide association studies.,5/8/2020
GCST003321,26732560,Cheng YC 2016,15.85,European|African American or Afro-Caribbean|South Asian,22570,Genome-Wide Association Analysis of Young-Onset Stroke Identifies a Locus on Chromosome 10q25 Near HABP2.,5/8/2020
GCST003322,26732560,Cheng YC 2016,15.85,European|African American or Afro-Caribbean|South Asian,22650,Genome-Wide Association Analysis of Young-Onset Stroke Identifies a Locus on Chromosome 10q25 Near HABP2.,5/8/2020
GCST003324,26732560,Cheng YC 2016,15.85,European|African American or Afro-Caribbean|South Asian,34342,Genome-Wide Association Analysis of Young-Onset Stroke Identifies a Locus on Chromosome 10q25 Near HABP2.,5/8/2020
GCST003325,26732429,Wang Z 2016,9.25,East Asian,26078,Meta-analysis of genome-wide association studies identifies multiple lung cancer susceptibility loci in never-smoking Asian women.,5/7/2020
GCST003326,26732429,Wang Z 2016,9.25,East Asian,26078,Meta-analysis of genome-wide association studies identifies multiple lung cancer susceptibility loci in never-smoking Asian women.,5/8/2020
GCST003327,26829030,Asgari MM 2016,NA,European,67867,Identification of Susceptibility Loci for Cutaneous Squamous Cell Carcinoma.,5/8/2020
GCST003342,26752265,Bailey JN 2016,133.278,European|East Asian,49749,"Genome-wide association analysis identifies TXNRD2, ATXN2 and FOXC1 as susceptibility loci for primary open-angle glaucoma.",5/8/2020
GCST003343,26752265,Bailey JN 2016,133.278,European,12233,"Genome-wide association analysis identifies TXNRD2, ATXN2 and FOXC1 as susceptibility loci for primary open-angle glaucoma.",5/8/2020
GCST003360,26891255,Jung ES 2016,0.75,East Asian,3952,HLA-C*01 is a Risk Factor for Crohn's Disease.,5/8/2020
GCST003370,26754954,Otowa T 2016,21.3,European,21761,Meta-analysis of genome-wide association studies of anxiety disorders.,5/8/2020
GCST003374,26831199,Pattaro C 2016,36,European,151137,Genetic associations at 53 loci highlight cell types and biological pathways relevant for kidney function.,5/8/2020
GCST003377,26888256,Hernandez W 2016,59.75,African American or Afro-Caribbean,737,Novel genetic predictors of venous thromboembolism risk in African Americans.,5/8/2020
GCST003378,26806518,Hou L 2016,179.028,European|East Asian,2563,Genetic variants associated with response to lithium treatment in bipolar disorder: a genome-wide association study.,5/8/2020
GCST003384,27206850,Wang M 2016,1.25,East Asian,8051,Genome-Wide Association Study of Bladder Cancer in a Chinese Cohort Reveals a New Susceptibility Locus at 5q12.3.,5/8/2020
GCST003390,26908601,Hinds DA 2016,20,European,258962,Genome-wide association analysis of self-reported events in 6135 individuals and 252 827 controls identifies 8 loci associated with thrombosis.,5/8/2020
GCST003391,26879886,Wakil SM 2016,7,Greater Middle Eastern,5495,A common variant association study reveals novel susceptibility loci for low HDL-cholesterol levels in ethnic Arabs.,5/8/2020
GCST003400,26818947,Imamura M 2016,20.2,East Asian|European|South Asian|Hispanic or Latin American,279087,Genome-wide association studies in the Japanese population identify seven novel loci for type 2 diabetes.,5/8/2020
GCST003402,27333618,Sekula P 2016,4.2,European,1184,Genetic risk variants for membranous nephropathy: extension of and association with other chronic kidney disease aetiologies.,5/8/2020
GCST003419,26965164,Hanchard NA 2016,1.25,European,8794,A genome-wide association study of congenital cardiovascular left-sided lesions shows association with a locus on chromosome 20.,5/8/2020
GCST003420,27207650,Schmit SL 2016,7,Hispanic or Latin American,5941,Genome-wide association study of colorectal cancer in Hispanics.,5/8/2020
GCST003421,27064253,Zhou W 2016,49.3,European|African unspecified,12369,Mosaic loss of chromosome Y is associated with common variation near TCL1A.,5/8/2020
GCST003422,26908436,Siiskonen SJ 2016,NA,European,14632,A Genome-Wide Association Study of Cutaneous Squamous Cell Carcinoma among European Descendants.,5/8/2020
GCST003424,27005825,Finkel TH 2016,0.25,European,10666,Variants in CXCR4 associate with juvenile idiopathic arthritis susceptibility.,5/8/2020
GCST003425,26912274,Zeng Y 2016,5.1,East Asian,4477,Novel loci and pathways significantly associated with longevity.,5/8/2020
GCST003429,26835600,Hu Y 2016,1285.434,European,89283,"GWAS of 89,283 individuals identifies genetic variants associated with self-reporting of being a morning person.",5/8/2020
GCST003430,26950853,Dehghan A 2016,5.85,European|African American or Afro-Caribbean,68950,Genome-Wide Association Study for Incident Myocardial Infarction and Coronary Heart Disease in Prospective Cohort Studies: The CHARGE Consortium.,5/8/2020
GCST003431,26950853,Dehghan A 2016,5.85,European,55170,Genome-Wide Association Study for Incident Myocardial Infarction and Coronary Heart Disease in Prospective Cohort Studies: The CHARGE Consortium.,5/8/2020
GCST003446,27001270,Vishal M 2016,0.5,South Asian,1317,Genetic association and stress mediated down-regulation in trabecular meshwork implicates MPP7 as a novel candidate gene in primary open angle glaucoma.,5/8/2020
GCST003450,26876947,Saito T 2016,14.85,East Asian,2955,Pharmacogenomic Study of Clozapine-Induced Agranulocytosis/Granulocytopenia in a Japanese Population.,5/8/2020
GCST003451,26767831,Grant AV 2016,0.5,Greater Middle Eastern,1660,A genome-wide association study of pulmonary tuberculosis in Morocco.,5/7/2020
GCST003454,26955885,Lane JM 2016,46.98,European,35672,"Genome-wide association analysis identifies novel loci for chronotype in 100,420 individuals from the UK Biobank.",5/8/2020
GCST003458,26824906,Rankinen T 2016,88.358,East Asian|European|Sub-Saharan African,3042,No Evidence of a Common DNA Variant Profile Specific to World Class Endurance Athletes.,5/8/2020
GCST003467,27064256,Khor CC 2016,73.95,East Asian|South Asian|European|Asian unspecified|Greater Middle Eastern|Hispanic or Latin American,40070,Genome-wide association study identifies five new susceptibility loci for primary angle closure glaucoma.,5/8/2020
GCST003468,26956414,Berndt SI 2016,9.8,European,18255,Meta-analysis of genome-wide association studies discovers multiple loci for chronic lymphocytic leukemia.,5/8/2020
GCST003470,26708285,Wakil SM 2016,173.8,Greater Middle Eastern,5668,A genome-wide association study reveals susceptibility loci for myocardial infarction/coronary artery disease in Saudi Arabs.,5/8/2020
GCST003471,26708285,Wakil SM 2016,173.8,Greater Middle Eastern,5668,A genome-wide association study reveals susceptibility loci for myocardial infarction/coronary artery disease in Saudi Arabs.,5/8/2020
GCST003482,27142222,White MJ 2016,419.76,African American or Afro-Caribbean,1227,Novel genetic risk factors for asthma in African American children: Precision Medicine and the SAGE II Study.,5/8/2020
GCST003489,27106561,Cornelis MC 2016,1.5,European,9314,A genome-wide investigation of food addiction.,5/8/2020
GCST003494,27145994,Wang M 2016,0.5,East Asian|European,16655,Common genetic variation in ETV6 is associated with colorectal cancer susceptibility.,5/8/2020
GCST003495,27167565,Stein MB 2016,145.042,European|African American or Afro-Caribbean|Hispanic or Latin American,13690,Genome-wide Association Studies of Posttraumatic Stress Disorder in 2 Cohorts of US Army Soldiers.,5/8/2020
GCST003501,27114598,Liu C 2016,104.7,European|African unspecified|Hispanic or Latin American|Asian unspecified,5185,Clinical and Genetic Risk Factors for Acute Pancreatitis in Patients With Acute Lymphoblastic Leukemia.,5/8/2020
GCST003520,27354352,Han MR 2016,0.75,East Asian,29053,Genome-wide association study in East Asians identifies two novel breast cancer susceptibility loci.,5/8/2020
GCST003522,27153935,Zhang CE 2016,NA,East Asian,1693,Variation at HLA-DPB1 is associated with dermatomyositis in Chinese population.,5/8/2020
GCST003524,27135401,Cheng TH 2016,100.546,European,44881,Five endometrial cancer risk loci identified through genome-wide association analysis.,5/8/2020
GCST003525,27135401,Cheng TH 2016,100.546,European,43779,Five endometrial cancer risk loci identified through genome-wide association analysis.,5/8/2020
GCST003539,27149122,Smith JG 2016,15.25,European,4698,Discovery of Genetic Variation on Chromosome 5q22 Associated with Mortality in Heart Failure.,5/8/2020
GCST003541,27173062,Azad AK 2016,NA,African American or Afro-Caribbean|Asian unspecified|European,1081,A genome-wide association study of non-HPV-related head and neck squamous cell carcinoma identifies prognostic genetic sequence variants in the MAP-kinase and hormone pathways.,5/8/2020
GCST003558,27519822,Power RA 2016,69.1,European|East Asian,156007,Genome-wide Association for Major Depression Through Age at Onset Stratification: Major Depressive Disorder Working Group of the Psychiatric Genomics Consortium.,5/8/2020
GCST003560,27171184,Kuo HC 2016,NA,East Asian,157,Genome-Wide Association Study Identifies Novel Susceptibility Genes Associated with Coronary Artery Aneurysm Formation in Kawasaki Disease.,5/10/2020
GCST003566,27386562,Andlauer TF 2016,169.23,European,21509,Novel multiple sclerosis susceptibility loci implicated in epigenetic regulation.,5/9/2020
GCST003578,27436580,Cui Q 2016,9.25,East Asian,15616,An extended genome-wide association study identifies novel susceptibility loci for nasopharyngeal carcinoma.,5/8/2020
GCST003581,27515689,Kerns SL 2016,70.05,European,1245,Meta-analysis of Genome Wide Association Studies Identifies Genetic Markers of Late Toxicity Following Radiotherapy for Prostate Cancer.,5/8/2020
GCST003582,27515689,Kerns SL 2016,70.05,European,1409,Meta-analysis of Genome Wide Association Studies Identifies Genetic Markers of Late Toxicity Following Radiotherapy for Prostate Cancer.,5/8/2020
GCST003584,27515689,Kerns SL 2016,70.05,European,1487,Meta-analysis of Genome Wide Association Studies Identifies Genetic Markers of Late Toxicity Following Radiotherapy for Prostate Cancer.,5/8/2020
GCST003586,27262462,Teerlink CC 2016,2.25,European,3893,Genome-wide association of familial prostate cancer cases identifies evidence for a rare segregating haplotype at 8q24.21.,5/8/2020
GCST003587,27197191,Fehringer G 2016,6,European,123671,"Cross-Cancer Genome-Wide Analysis of Lung, Ovary, Breast, Prostate, and Colorectal Cancer Reveals Novel Pleiotropic Associations.",5/8/2020
GCST003589,27439200,Nieuwenhuis MA 2016,25.5,European,13556,Combining genomewide association study and lung eQTL analysis provides evidence for novel genes associated with asthma.,5/8/2020
GCST003602,27569725,Yang SK 2016,6.1,East Asian,11026,Identification of Loci at 1q21 and 16q23 That Affect Susceptibility to Inflammatory Bowel Disease in Koreans.,5/8/2020
GCST003603,27558924,Kim HS 2016,6.1,East Asian,1034,A coding variant in FTO confers susceptibility to thiopurine-induced leukopenia in East Asian patients with IBD.,5/8/2020
GCST003604,27503288,Song IW 2016,NA,East Asian,16296,Identification of susceptibility gene associated with female primary Sj�gren's syndrome in Han Chinese by genome-wide association study.,5/8/2020
GCST003605,27501781,Shiraishi K 2016,5.25,East Asian,18331,Association of variations in HLA class II and other loci with susceptibility to EGFR-mutated lung adenocarcinoma.,5/9/2020
GCST003613,27480026,Liu X 2016,2,East Asian,21990,Genome Wide Association Study Identifies L3MBTL4 as a Novel Susceptibility Gene for Hypertension.,5/8/2020
GCST003614,26239289,Nelson EC 2015,17.25,European,2637,Evidence of CNIH3 involvement in opioid dependence.,5/8/2020
GCST003615,27244555,Li Y 2016,1.5,East Asian,9569,Genome-wide association study identifies 8p21.3 associated with persistent hepatitis B virus infection among Chinese.,5/8/2020
GCST003619,27189021,Cook JP 2016,5.6,European|African American or Afro-Caribbean|East Asian|Hispanic or Latin American,140637,Multi-ethnic genome-wide association study identifies novel locus for type 2 diabetes susceptibility.,5/8/2020
GCST003622,27399966,Morris DL 2016,69.404,East Asian|European,35844,Genome-wide association meta-analysis in Chinese and European individuals identifies ten new loci associated with systemic lupus erythematosus.,5/10/2020
GCST003623,27559109,Bustamante M 2016,23.95,European,9124,A genome-wide association meta-analysis of diarrhoeal disease in young children identifies FUT2 locus and provides plausible biological pathways.,5/8/2020
GCST003624,27559109,Bustamante M 2016,23.95,European,13955,A genome-wide association meta-analysis of diarrhoeal disease in young children identifies FUT2 locus and provides plausible biological pathways.,5/9/2020
GCST003625,27559109,Bustamante M 2016,23.95,European,13868,A genome-wide association meta-analysis of diarrhoeal disease in young children identifies FUT2 locus and provides plausible biological pathways.,5/8/2020
GCST003626,27559109,Bustamante M 2016,23.95,European,9526,A genome-wide association meta-analysis of diarrhoeal disease in young children identifies FUT2 locus and provides plausible biological pathways.,5/8/2020
GCST003628,27400856,Legge SE 2016,19.6,European,7006,Genome-wide common and rare variant analysis provides novel insights into clozapine-associated neutropenia.,5/8/2020
GCST003640,27304844,Khong JJ 2016,2,European,951,Association of Polymorphisms in MACRO Domain Containing 2 With Thyroid-Associated Orbitopathy.,5/8/2020
GCST003648,27315593,Lang M 2016,17.95,European,1431,Genome-wide association study of pathological gambling.,5/8/2020
GCST003652,27402877,Hill-Burns EM 2016,11,European,1168,Identification of genetic modifiers of age-at-onset for familial Parkinson's disease.,5/8/2020
GCST003655,27424798,Chahal HS 2016,117.85,European,299480,Genome-wide association study identifies novel susceptibility loci for cutaneous squamous cell carcinoma.,5/8/2020
GCST003677,27225129,Okbay A 2016,1153.482,European,280007,Genome-wide association study identifies 74 loci associated with educational attainment.,5/8/2020
GCST003683,27418160,van 't Hof FN 2016,6.45,European,12601,"Shared Genetic Risk Factors of Intracranial, Abdominal, and Thoracic Aneurysms.",5/8/2020
GCST003720,27322543,Gormley P 2016,1126.066,European,375752,"Meta-analysis of 375,000 individuals identifies 38 susceptibility loci for migraine.",5/8/2020
GCST003721,27322543,Gormley P 2016,1126.066,European,147970,"Meta-analysis of 375,000 individuals identifies 38 susceptibility loci for migraine.",5/8/2020
GCST003724,27329760,Hou L 2016,3,European,40255,"Genome-wide association study of 40,000 individuals identifies two novel loci associated with bipolar disorder.",5/8/2020
GCST003725,27094239,Joshi AD 2016,6.85,European|African American or Afro-Caribbean|Hispanic or Latin American,147261,Four Susceptibility Loci for Gallstone Disease Identified in a Meta-analysis of Genome-Wide Association Studies.,5/8/2020
GCST003726,27539887,Chahal HS 2016,19.35,European,291308.945,Genome-wide association study identifies 14 novel risk alleles associated with basal cell carcinoma.,5/8/2020
GCST003738,27527254,Gharahkhani P 2016,66.35,European,23326,Genome-wide association studies in oesophageal adenocarcinoma and Barrett's oesophagus: a large-scale meta-analysis.,5/8/2020
GCST003739,27527254,Gharahkhani P 2016,66.35,European,21271,Genome-wide association studies in oesophageal adenocarcinoma and Barrett's oesophagus: a large-scale meta-analysis.,5/9/2020
GCST003740,27527254,Gharahkhani P 2016,66.35,European,27438,Genome-wide association studies in oesophageal adenocarcinoma and Barrett's oesophagus: a large-scale meta-analysis.,5/9/2020
GCST003742,27769005,Nassan M 2016,0.25,European,3299,A genome wide association study suggests the association of muskelin with early onset bipolar disorder: Implications for a GABAergic epileptogenic neurogenesis model.,5/8/2020
GCST003743,27599772,Ram R 2016,NA,Greater Middle Eastern,5501,A common variant association study in ethnic Saudi Arabs reveals novel susceptibility loci for hypertriglyceridemia.,5/8/2020
GCST003758,27579533,Zhang M 2016,2,European,27583,"Three new pancreatic cancer susceptibility signals identified on chromosomes 1q32.1, 5p15.33 and 8q24.21.",5/8/2020
GCST003760,27670397,Reyes-Gibby CC 2016,NA,European,1368,Genome-wide association study suggests common variants within RP11-634B7.4 gene influencing severe pre-treatment pain in head and neck cancer patients.,5/8/2020
GCST003762,27797806,M�ller SH 2016,124.572,European,9248,Genome-wide association study in essential tremor identifies three new loci.,5/8/2020
GCST003763,27764096,Hoffmann TJ 2016,119.38,European|Hispanic or Latin American|East Asian|African American or Afro-Caribbean,65822,A Large Genome-Wide Association Study of Age-Related Hearing Impairment Using Electronic Health Records.,5/8/2020
GCST003764,27702942,Tang CS 2016,NA,European|East Asian,1698,Trans-ethnic meta-analysis of genome-wide association studies for Hirschsprung disease.,5/8/2020
GCST003775,27393504,Zanetti KA 2016,1.35,African American or Afro-Caribbean,7001,Genome-wide association study confirms lung cancer susceptibility loci on chromosomes 5p15 and 15q25 in an African-American population.,5/8/2020
GCST003776,27393504,Zanetti KA 2016,1.35,African American or Afro-Caribbean,5788,Genome-wide association study confirms lung cancer susceptibility loci on chromosomes 5p15 and 15q25 in an African-American population.,5/8/2020
GCST003780,28171663,Huo D 2016,NA,Sub-Saharan African|African American or Afro-Caribbean,9677,Genome-wide association studies in women of African ancestry identified 3q26.21 as a novel susceptibility locus for oestrogen receptor negative breast cancer.,5/8/2020
GCST003781,28171663,Huo D 2016,NA,Sub-Saharan African|African American or Afro-Caribbean,10700,Genome-wide association studies in women of African ancestry identified 3q26.21 as a novel susceptibility locus for oestrogen receptor negative breast cancer.,5/8/2020
GCST003782,28171663,Huo D 2016,NA,Sub-Saharan African|African American or Afro-Caribbean,14370,Genome-wide association studies in women of African ancestry identified 3q26.21 as a novel susceptibility locus for oestrogen receptor negative breast cancer.,5/8/2020
GCST003784,27629089,Sailer A 2016,3.25,European,4782,A genome-wide association study in multiple system atrophy.,5/8/2020
GCST003792,27671213,Petros Z 2016,0.25,Sub-Saharan African,646,Genome-wide association and replication study of anti-tuberculosis drugs-induced liver toxicity.,5/8/2020
GCST003797,27670767,Chang SW 2016,9.5,European|Hispanic or Latin American|African American or Afro-Caribbean,1140,Genome-wide association study identifies pharmacogenomic loci linked with specific antihypertensive drug treatment and new-onset diabetes.,5/8/2020
GCST003798,27694927,Vijayakrishnan J 2016,5,European,14967,A genome-wide association study identifies risk loci for childhood acute lymphoblastic leukemia at 10q26.13 and 12q23.1.,5/8/2020
GCST003799,26965516,Zeng C 2016,2,East Asian,50176,Identification of Susceptibility Loci and Genes for Colorectal Cancer Risk.,5/8/2020
GCST003800,27622933,Li QS 2016,90.1,European,4536,Analysis of 23andMe antidepressant efficacy survey data: implication of circadian rhythm and neuroplasticity in bupropion response.,5/8/2020
GCST003817,27639821,Scherag A 2016,20.45,European,3274,Genetic Factors of the Disease Course after Sepsis: A Genome-Wide Study for 28Day Mortality.,5/8/2020
GCST003820,27696742,Yau MS 2016,1.75,European,7066,Genome-Wide Association Study of Radiographic Knee Osteoarthritis in North American Caucasians.,5/8/2020
GCST003824,27723809,Matsunami K 2016,0.5,East Asian,384,Genome-Wide Association Study Identifies ZNF354C Variants Associated with Depression from Interferon-Based Therapy for Chronic Hepatitis C.,5/8/2020
GCST003827,27632927,Einarsdottir E 2016,1.25,European,2876,Genome-wide association analysis reveals variants on chromosome 19 that contribute to childhood risk of chronic otitis media with effusion.,5/8/2020
GCST003828,27632927,Einarsdottir E 2016,1.25,European,7445,Genome-wide association analysis reveals variants on chromosome 19 that contribute to childhood risk of chronic otitis media with effusion.,5/8/2020
GCST003829,27632927,Einarsdottir E 2016,1.25,European,2775,Genome-wide association analysis reveals variants on chromosome 19 that contribute to childhood risk of chronic otitis media with effusion.,5/8/2020
GCST003838,27494321,Jones SE 2016,108.28,European,114765,"Genome-Wide Association Analyses in 128,266 Individuals Identifies New Morningness and Sleep Duration Loci.",5/8/2020
GCST003840,27494321,Jones SE 2016,108.28,European,39082,"Genome-Wide Association Analyses in 128,266 Individuals Identifies New Morningness and Sleep Duration Loci.",5/8/2020
GCST003857,27749845,Lesseur C 2016,97.5,European,12619,Genome-wide association analyses identify new susceptibility loci for oral cavity and pharyngeal cancer.,5/8/2020
GCST003858,27749845,Lesseur C 2016,97.5,European,9575,Genome-wide association analyses identify new susceptibility loci for oral cavity and pharyngeal cancer.,5/8/2020
GCST003859,27749845,Lesseur C 2016,97.5,European,9226,Genome-wide association analyses identify new susceptibility loci for oral cavity and pharyngeal cancer.,5/8/2020
GCST003861,27647854,Sandholm N 2016,5.35,European,8079,The Genetic Landscape of Renal Complications in Type 1 Diabetes.,5/8/2020
GCST003862,27647854,Sandholm N 2016,5.35,European,11665,The Genetic Landscape of Renal Complications in Type 1 Diabetes.,5/8/2020
GCST003863,27647854,Sandholm N 2016,5.35,European,7056,The Genetic Landscape of Renal Complications in Type 1 Diabetes.,5/8/2020
GCST003864,27647854,Sandholm N 2016,5.35,European,13134,The Genetic Landscape of Renal Complications in Type 1 Diabetes.,5/8/2020
GCST003865,27647854,Sandholm N 2016,5.35,European,5454,The Genetic Landscape of Renal Complications in Type 1 Diabetes.,5/8/2020
GCST003866,27647854,Sandholm N 2016,5.35,European,10793,The Genetic Landscape of Renal Complications in Type 1 Diabetes.,5/8/2020
GCST003867,27647854,Sandholm N 2016,5.35,European,10759,The Genetic Landscape of Renal Complications in Type 1 Diabetes.,5/8/2020
GCST003873,27723779,Gong J 2016,24.47,European,16823,Genome-Wide Interaction Analyses between Genetic Variants and Alcohol Consumption and Smoking for Risk of Colorectal Cancer.,5/8/2020
GCST003877,27899403,Jones GT 2016,61.85,European,117970,Meta-Analysis of Genome-Wide Association Studies for Abdominal Aortic Aneurysm Identifies Four New Disease-Specific Risk Loci.,5/8/2020
GCST003900,27957625,Bacchelli E 2016,1.5,European,458,A genome-wide analysis in cluster headache points to neprilysin and PACAP receptor gene variants.,5/8/2020
GCST003922,28011712,Foo JN 2016,9.5,East Asian|Asian unspecified,36735,Genome-wide association study of Parkinson's disease in East Asians.,5/8/2020
GCST003924,27899376,Nakayama A 2016,3,East Asian,3659,GWAS of clinically defined gout and subtypes identifies multiple susceptibility loci that include urate transporter genes.,5/8/2020
GCST003925,27899376,Nakayama A 2016,3,East Asian|European|Oceanian,8191,GWAS of clinically defined gout and subtypes identifies multiple susceptibility loci that include urate transporter genes.,5/8/2020
GCST003926,27899376,Nakayama A 2016,3,East Asian,3796,GWAS of clinically defined gout and subtypes identifies multiple susceptibility loci that include urate transporter genes.,5/8/2020
GCST003963,28051079,Warner SC 2017,NA,,613,Genome-wide association scan of neuropathic pain symptoms post total joint replacement highlights a variant in the protein-kinase C gene.,5/9/2020
GCST003964,28317148,Campo C 2016,0.5,European,646,Bortezomib-induced peripheral neuropathy: A genome-wide association study on multiple myeloma patients.,5/8/2020
GCST003974,27941131,Feenstra B 2016,12.374,European,16425,Genome-wide association study identifies variants in HORMAD2 associated with tonsillectomy.,5/8/2020
GCST003976,28029757,Merkel PA 2016,6.75,European,6515,Identification of Functional and Expression Polymorphisms Associated With Risk for Antineutrophil Cytoplasmic Autoantibody-Associated Vasculitis.,5/8/2020
GCST003977,28029757,Merkel PA 2016,6.75,European,5101,Identification of Functional and Expression Polymorphisms Associated With Risk for Antineutrophil Cytoplasmic Autoantibody-Associated Vasculitis.,5/8/2020
GCST003981,27992416,Lane JM 2016,333.514,European,59128,Genome-wide association analyses of sleep disturbance traits identify new loci and highlight shared genetics with neuropsychiatric and metabolic traits.,5/8/2020
GCST004001,27890468,van Hulzen KJE 2016,19.2,European,35622,Genetic Overlap Between Attention-Deficit/Hyperactivity Disorder and Bipolar Disorder: Evidence From Genome-wide Association Study Meta-analysis.,5/8/2020
