studyID	pubMedID	trait	reportedTrait	citation	altmetricScore	ethnicity	initialSampleSize	replicationSampleSize	title	lastUpdated
GCST003587	27197191	Colorectal Cancer	Cancer	Fehringer G 2016	6	European	123671	NA	"Cross-Cancer Genome-Wide Analysis of Lung, Ovary, Breast, Prostate, and Colorectal Cancer Reveals Novel Pleiotropic Associations."	5/8/2020
GCST002415	24743840	Colorectal Cancer	Colorectal Cancer (Diet Interaction)	Figueiredo JC 2014	75.044	European	18404	NA	Genome-wide diet-gene interaction analyses for risk of colorectal cancer.	5/8/2020
GCST003873	27723779	Colorectal Cancer	Colorectal Cancer (Alcohol Consumption Interaction)	Gong J 2016	24.97	European	16823	NA	Genome-Wide Interaction Analyses between Genetic Variants and Alcohol Consumption and Smoking for Risk of Colorectal Cancer.	5/8/2020
GCST000270	19011631	Colorectal Cancer	Colorectal Cancer	Houlston RS 2008	3.25	European	3831	37210	Meta-analysis of genome-wide association data identifies four new susceptibility loci for colorectal cancer.	5/8/2020
GCST000843	20972440	Colorectal Cancer	Colorectal Cancer	Houlston RS 2010	10.33	European	7962	30420	"Meta-analysis of three genome-wide association studies identifies susceptibility loci for colorectal cancer at 1q41, 3q26.2, 12q13.13 and 20q13.33."	5/7/2020
GCST007856	30510241	Colorectal Cancer	Colorectal Cancer Or Advanced Adenoma	Huyghe JR 2018	179.18	European|East Asian	125478	NA	Discovery of common and rare genetic risk variants for colorectal cancer.	5/10/2020
GCST001792	23263487	Colorectal Cancer	Colorectal Cancer	Jia WH 2012	2.5	East Asian|European	7847	37340	Genome-wide association analyses in East Asians identify new susceptibility loci for colorectal cancer.	5/8/2020
GCST007992	31089142	Colorectal Cancer	Colorectal Cancer	Law PJ 2019	32.4	European	92967	NA	Association analyses identify 31 new risk loci for colorectal cancer susceptibility.	5/10/2020
GCST007552	30529582	Colorectal Cancer	Colorectal Cancer	Lu Y 2018	10.25	East Asian	70506	NA	Large-scale Genome-wide Association Study of East Asians Identifies Loci Associated With Risk for Colorectal Cancer.	5/10/2020
GCST009869	31826910	Colorectal Cancer	Colorectal Cancer	Lu Y 2019	1.85	East Asian|European	72272	125478	Identification of novel loci and new risk variant in known loci for colorectal cancer risk in East Asians.	5/10/2020
GCST006035	29698419	Colorectal Cancer	Breast Cancer And/Or Colorectal Cancer	Pande M 2018	2.85	European	2754	NA	Genetic susceptibility markers for a breast-colorectal cancer phenotype: Exploratory results from genome-wide association studies.	5/9/2020
GCST006411	29942513	Colorectal Cancer	Mucinous Adenocarcinoma In Colorectal Cancer	Penney ME 2018	0.75	European	505	NA	Associations of single nucleotide polymorphisms with mucinous colorectal cancer: genome-wide common variant and gene-based rare variant analyses.	5/9/2020
GCST001787	23266556	Colorectal Cancer	Colorectal Cancer	Peters U 2012	17.2	East Asian|European	27809	9714	Identification of Genetic Susceptibility Loci for Colorectal Tumors in a Genome-Wide Meta-analysis.	5/8/2020
GCST003230	26586795	Colorectal Cancer	Survival In Colorectal Cancer (Distant Metastatic)	Phipps AI 2015	2	European	462	435	Common genetic variation and survival after colorectal cancer diagnosis: a genome-wide analysis.	5/8/2020
GCST003231	26586795	Colorectal Cancer	Survival In Colorectal Cancer (Non-Distant Metastatic)	Phipps AI 2015	2	European	2843	3205	Common genetic variation and survival after colorectal cancer diagnosis: a genome-wide analysis.	5/8/2020
GCST002528	25023989	Colorectal Cancer	Colorectal Cancer	Schmit SL 2014	3	Other|European	3959	1962	A novel colorectal cancer risk locus at 4q32.2 identified from an international genome-wide association study.	5/8/2020
GCST003420	27207650	Colorectal Cancer	Colorectal Cancer	Schmit SL 2016	7	Hispanic or Latin American	5941	NA	Genome-wide association study of colorectal cancer in Hispanics.	5/8/2020
GCST006131	29917119	Colorectal Cancer	Colorectal Cancer	Schmit SL 2018	19.95	European|East Asian|Hispanic or Latin American|African American or Afro-Caribbean	67812	95503	Novel Common Genetic Susceptibility Loci for Colorectal Cancer.	5/9/2020
GCST003017	26151821	Colorectal Cancer	Colorectal Cancer	Schumacher FR 2015	22.35	European|East Asian	37955	14694	Genome-wide association study of colorectal cancer identifies six new susceptibility loci.	5/8/2020
GCST005591	29471430	Colorectal Cancer	Colorectal Cancer	Tanikawa C 2018	0.5	East Asian	33870	11046	GWAS Identifies Two Novel Colorectal Cancer Loci at 16q24.1 and 20q13.12.	5/9/2020
GCST004895	28960316	Colorectal Cancer	Colorectal Cancer	Tanskanen T 2017	3	European	15783	24003	Genome-wide association study and meta-analysis in Northern European populations replicate multiple colorectal cancer risk loci.	5/8/2020
GCST000168	18372901	Colorectal Cancer	Colorectal Cancer	Tenesa A 2008	15	European|East Asian	1983	31827	Genome-wide association scan identifies a colorectal cancer susceptibility locus on 11q23 and replicates risk loci at 8q24 and 18q21.	5/8/2020
GCST000053	17618284	Colorectal Cancer	Colorectal Cancer	Tomlinson I 2007	20	European	1890	12580	A genome-wide association scan of tag SNPs identifies a susceptibility variant for colorectal cancer at 8q24.21.	5/7/2020
GCST000169	18372905	Colorectal Cancer	Colorectal Cancer	Tomlinson IP 2008	18.25	European	1849	35398	A genome-wide association study identifies colorectal cancer susceptibility loci on chromosomes 10p14 and 8q23.3.	5/10/2020
GCST002561	25105248	Colorectal Cancer	Colorectal Cancer	Wang H 2014	4.35	East Asian|African American or Afro-Caribbean|European	13020	35034	Trans-ethnic genome-wide association study of colorectal cancer identifies a new susceptibility locus in VTI1A.	5/7/2020
GCST004168	28295283	Colorectal Cancer	Colorectal Cancer	Wang H 2017	1.35	African American or Afro-Caribbean|Hispanic or Latin American	6597	7982	Novel colon cancer susceptibility variants identified from a genome-wide association study in African Americans.	5/8/2020
GCST003494	27145994	Colorectal Cancer	Colorectal Cancer	Wang M 2016	0.75	East Asian|European	2329	14326	Common genetic variation in ETV6 is associated with colorectal cancer susceptibility.	5/8/2020
GCST002411	24737748	Colorectal Cancer	Colorectal Cancer	Whiffin N 2014	0.5	European	13443	29974	Identification of susceptibility loci for colorectal cancer in a genome-wide meta-analysis.	5/8/2020
GCST000052	17618283	Colorectal Cancer	Colorectal Cancer	Zanke BW 2007	15	European	2593	12666	Genome-wide association scan identifies a colorectal cancer susceptibility locus on chromosome 8q24.	5/7/2020
GCST003799	26965516	Colorectal Cancer	Colorectal Cancer	Zeng C 2016	2.25	East Asian	21096	29080	Identification of Susceptibility Loci and Genes for Colorectal Cancer Risk.	5/8/2020
GCST002340	24448986	Colorectal Cancer	Colorectal Cancer	Zhang B 2014	NA	East Asian	4415	14764	Genome-wide association study identifies a new SMAD7 risk variant associated with colorectal cancer risk in East Asians.	5/8/2020
GCST002454	24836286	Colorectal Cancer	Colorectal Cancer	Zhang B 2014	10	East Asian|European	8270	73884	Large-scale genetic study in East Asians identifies six new loci associated with colorectal cancer risk.	5/7/2020
GCST006411	29942513	Colorectal Mucinous Adenocarcinoma	Mucinous Adenocarcinoma In Colorectal Cancer	Penney ME 2018	0.75	European	505	NA	Associations of single nucleotide polymorphisms with mucinous colorectal cancer: genome-wide common variant and gene-based rare variant analyses.	5/9/2020
GCST002729	25557950	Complicated Disease Course	Crohn's Disease-Related Phenotypes	Alonso A 2015	10.75	European	1090	1296	Identification of risk loci for Crohn's disease phenotypes using a genome-wide association study.	5/8/2020
GCST000714	20585324	Conduct Disorder	Conduct Disorder	Dick DM 2010	3	European|African American or Afro-Caribbean|Other	3963	NA	Genome-wide association study of conduct disorder symptomatology.	5/7/2020
GCST002035	23708191	Congenital Heart Disease	Congenital Heart Disease	Cordell HJ 2013	49.75	European	6978	3146	Genome-wide association study of multiple congenital heart disease phenotypes identifies a susceptibility locus for atrial septal defect at chromosome 4p16.	5/8/2020
GCST002036	23708190	Congenital Heart Malformation	Congenital Heart Malformation	Hu Z 2013	4	East Asian	2191	6026	A genome-wide association study identifies two risk loci for congenital heart malformations in Han Chinese populations.	5/8/2020
GCST003419	26965164	Congenital Left-Sided Heart Lesions	Congenital Left-Sided Heart Lesions	Hanchard NA 2016	1.25	European	3268	5526	A genome-wide association study of congenital cardiovascular left-sided lesions shows association with a locus on chromosome 20.	5/8/2020
GCST002108	23921680	Contact Dermatitis Due To Nickel	Allergic Dermatitis (Nickel)	Kim DS 2013	NA	East Asian	76	NA	A genome-wide association study in Koreans identifies susceptibility loci for allergic nickel dermatitis.	5/7/2020
GCST005803	29422769	Corneal Astigmatism	Corneal Astigmatism	Shah RL 2018	1	European|Asian unspecified	31370	NA	A genome-wide association study of corneal astigmatism: The CREAM Consortium.	5/8/2020
GCST007157	30306274	Corneal Astigmatism	Corneal Astigmatism	Shah RL 2018	3	European	86335	NA	Genome-wide association studies for corneal and refractive astigmatism in UK Biobank demonstrate a shared role for myopia susceptibility loci.	5/9/2020
GCST002026	23677057	Coronary Aneurysm	Coronary Arterial Lesions In Patients With Kawasaki Disease	Kim JJ 2013	NA	East Asian	140	223	Identification of KCNN2 as a susceptibility locus for coronary artery aneurysms in Kawasaki disease using genome-wide association analysis.	5/8/2020
GCST003560	27171184	Coronary Aneurysm	Coronary Artery Aneurysm In Kawasaki Disease	Kuo HC 2016	0.5	East Asian	157	NA	Genome-Wide Association Study Identifies Novel Susceptibility Genes Associated with Coronary Artery Aneurysm Formation in Kawasaki Disease.	5/10/2020
GCST007192	30267110	Coronary Aneurysm	Coronary Artery Aneurysm In Kawasaki Disease	Kwon YC 2018	0.25		248	544	Identification of the TIFAB Gene as a Susceptibility Locus for Coronary Artery Aneurysm in Patients with Kawasaki Disease.	5/9/2020
GCST006435	30103242	Coronary Artery Bypass	Thrombocytopenia In Coronary Artery Bypass Surgery	Karhausen JA 2018	NA	European	444	146	Genome-Wide Association Study Links Receptor Tyrosine Kinase Inhibitor Sprouty 2 to Thrombocytopenia after Coronary Artery Bypass Surgery.	5/9/2020
GCST002975	26385043	Coronary Artery Bypass	Postoperative Atrial Fibrillation In Coronary Artery Bypass Grafting Surgery	Kertai MD 2015	8.6	European	877	304	Genome-wide association study of new-onset atrial fibrillation after coronary artery bypass grafting surgery.	5/8/2020
GCST004224	28355232	Coronary Atherosclerosis Measurement	Coronary Atherosclerosis (Increased Number Of Diseased Vessels) (Traffic Exposure Interaction)	Ward-Caviness CK 2017	1.75	African American or Afro-Caribbean|European	2100	NA	A genome-wide trans-ethnic interaction study links the PIGR-FCAMR locus to coronary atherosclerosis via interactions between genetic variants and residential exposure to traffic.	5/8/2020
GCST006281	29695241	Coronary Heart Disease	Coronary Artery Disease In Type 1 Diabetes	Charmet R 2018	2.25	European	3557	3197	Novel risk genes identified in a genome-wide association study for coronary artery disease in patients with type 1 diabetes.	5/9/2020
GCST000999	21378988	Coronary Heart Disease	Coronary Heart Disease	Coronary Artery Disease (C4D) Genetics Consortium 2011	11.562	European|South Asian	30482	40593	A genome-wide association study in Europeans and South Asians identifies five new loci for coronary artery disease.	5/9/2020
GCST001401	22319020	Coronary Heart Disease	Coronary Heart Disease	Davies RW 2012	0.5	European	13949	11032	A genome-wide association study for coronary artery disease identifies a novel susceptibility locus in the major histocompatibility complex.	5/7/2020
GCST003431	26950853	Coronary Heart Disease	Incident Coronary Heart Disease	Dehghan A 2016	5.6	European	24024	31146	Genome-Wide Association Study for Incident Myocardial Infarction and Coronary Heart Disease in Prospective Cohort Studies: The CHARGE Consortium.	5/8/2020
GCST002289	24262325	Coronary Heart Disease	Coronary Artery Disease	Dichgans M 2013	9.1		109124	NA	Shared genetic susceptibility to ischemic stroke and coronary artery disease: a genome-wide analysis of common variants.	5/8/2020
GCST002298	24778558	Coronary Heart Disease	Coronary Heart Disease	Domarkienė I 2013	NA	European	126	NA	RTN4 and FBXL17 Genes are Associated with Coronary Heart Disease in Genome-Wide Association Analysis of Lithuanian Families.	5/8/2020
GCST000338	19198612	Coronary Heart Disease	Coronary Heart Disease	Erdmann J 2009	19	European	2520	38253	New susceptibility locus for coronary artery disease on chromosome 3q22.3.	5/7/2020
GCST000875	21088011	Coronary Heart Disease	Coronary Heart Disease	Erdmann J 2010	3.75	European	2905	16131	Genome-wide association study identifies a new locus for coronary artery disease on chromosome 10p11.23.	5/7/2020
GCST006405	30003307	Coronary Heart Disease	Coronary Artery Disease In Diabetes	Fall T 2018	17.65	European	15666	NA	Genome-wide association study of coronary artery disease among individuals with diabetes: the UK Biobank.	5/9/2020
GCST001581	22745674	Coronary Heart Disease	Coronary Heart Disease	Hager J 2012	NA	Greater Middle Eastern (Middle Eastern North African or Persian)	1949	2547	Genome-wide association study in a Lebanese cohort confirms PHACTR1 as a major determinant of coronary artery stenosis.	5/8/2020
GCST005172	29263402	Coronary Heart Disease	Coronary Artery Disease	Han Y 2017	2.6	East Asian|South Asian|South East Asian	9545	2139	Genome-wide association study identifies a missense variant at APOA5 for coronary artery disease in Multi-Ethnic Cohorts from Southeast Asia.	5/8/2020
GCST010089	23593153	Coronary Heart Disease	Sudden Cardiac Arrest In Coronary Artery Disease	Huertas-Vazquez A 2013	NA	European	3998	NA	Novel loci associated with increased risk of sudden cardiac death in the context of coronary artery disease.	6/19/2020
GCST007990	28714974	Coronary Heart Disease	Coronary Artery Disease	Klarin D 2017	95.95	European	120286	184305	Genetic analysis in UK Biobank links insulin resistance and transendothelial migration pathways to coronary artery disease.	5/10/2020
GCST001845	23364394	Coronary Heart Disease	Coronary Heart Disease	Lee JY 2013	15.108	East Asian	5714	8028	A genome-wide association study of a coronary artery disease risk variant.	5/7/2020
GCST000972	21347282	Coronary Heart Disease	Coronary Heart Disease	Lettre G 2011	9	African American or Afro-Caribbean	5313	2250	"Genome-wide association study of coronary heart disease and its risk factors in 8,090 African Americans: the NHLBI CARe Project."	5/7/2020
GCST005582	29472232	Coronary Heart Disease	Coronary Artery Disease	Li Y 2018	3.6	East Asian	630	21198	Genome-Wide Association and Functional Studies Identify SCML4 and THSD7A as Novel Susceptibility Genes for Coronary Artery Disease.	5/9/2020
GCST001587	22751097	Coronary Heart Disease	Coronary Heart Disease	Lu X 2012	1	East Asian	6534	26932	Genome-wide association study in Han Chinese identifies four new susceptibility loci for coronary artery disease.	5/9/2020
GCST010479	32469254	Coronary Heart Disease	Coronary Artery Disease	Matsunaga H 2020	4.6	East Asian|European	392241	NA	Transethnic Meta-analysis of Genome-wide Association Studies Identifies Three New Loci and Characterizes Population-specific Differences for Coronary Artery Disease.	9/2/2020
GCST010480	32469254	Coronary Heart Disease	Coronary Artery Disease	Matsunaga H 2020	4.6	East Asian	51442	NA	Transethnic Meta-analysis of Genome-wide Association Studies Identifies Three New Loci and Characterizes Population-specific Differences for Coronary Artery Disease.	9/2/2020
GCST004787	28714975	Coronary Heart Disease	"Coronary Artery Disease (Myocardial Infarction, Percutaneous Transluminal Coronary Angioplasty, Coronary Artery Bypass Grafting, Angina Or Chromic Ischemic Heart Disease)"	Nelson CP 2017	46.3	European	63731	276868	Association analyses based on false discovery rate implicate new loci for coronary artery disease.	5/8/2020
GCST003116	26343387	Coronary Heart Disease	Coronary Artery Disease	Nikpay M 2015	198.786	European|African American or Afro-Caribbean|Hispanic or Latin American|South Asian|Greater Middle Eastern (Middle Eastern North African or Persian)|East Asian	187599	NA	"A comprehensive 1,000 Genomes-based genome-wide association meta-analysis of coronary artery disease."	5/9/2020
GCST000945	21239051	Coronary Heart Disease	Coronary Artery Disease	Reilly MP 2011	5	European	2723	17053	Identification of ADAMTS7 as a novel locus for coronary atherosclerosis and association of ABO with myocardial infarction in the presence of coronary atherosclerosis: two genome-wide association studies.	5/8/2020
GCST000946	21239051	Coronary Heart Disease	Myocardial Infarction In Coronary Artery Disease	Reilly MP 2011	5	European	7311	2116	Identification of ADAMTS7 as a novel locus for coronary atherosclerosis and association of ABO with myocardial infarction in the presence of coronary atherosclerosis: two genome-wide association studies.	5/8/2020
GCST000057	17634449	Coronary Heart Disease	Coronary Heart Disease	Samani NJ 2007	22.25	European	4864	2519	Genomewide association analysis of coronary artery disease.	5/9/2020
GCST000998	21378990	Coronary Heart Disease	Coronary Heart Disease	Schunkert H 2011	87.07	European	86995	56682	Large-scale association analysis identifies 13 new susceptibility loci for coronary artery disease.	5/9/2020
GCST001260	21971053	Coronary Heart Disease	Coronary Heart Disease	Takeuchi F 2011	1	East Asian	2143	9928	Genome-wide association study of coronary artery disease in the Japanese.	5/9/2020
GCST003470	26708285	Coronary Heart Disease	Coronary Artery Disease	Wakil SM 2016	167	Greater Middle Eastern (Middle Eastern North African or Persian)	4431	1237	A genome-wide association study reveals susceptibility loci for myocardial infarction/coronary artery disease in Saudi Arabs.	5/8/2020
GCST000045	17554300	Coronary Heart Disease	Coronary Heart Disease	Wellcome Trust Case Control Consortium 2007	134.5	European	4864	2007	"Genome-wide association study of 14,000 cases of seven common diseases and 3,000 shared controls."	5/7/2020
GCST007230	30563176	Coronary Heart Disease	Severe Depressive Disorders In Coronary Artery Disease	Westermair AL 2018	0.75	European	342	NA	Association of Genetic Variation at AQP4 Locus with Vascular Depression.	5/10/2020
GCST001079	21606135	Coronary Heart Disease	Coronary Heart Disease	Wild PS 2011	3	European	5031	54758	A genome-wide association study identifies LIPA as a susceptibility gene for coronary artery disease.	5/9/2020
GCST009879	30402224	Coronary Heart Disease	Coronary Artery Disease	Yamada Y 2018	NA	East Asian	7256	NA	Identification of 26 novel loci that confer susceptibility to early-onset coronary artery disease in a Japanese population.	5/10/2020
GCST004957	28753643	Coronary Heart Disease	Major Coronary Event In Darapladib-Treated Cardiovascular Disease (Time To Event)	Yeo A 2017	0.25	European|Asian unspecified|African American or Afro-Caribbean|Greater Middle Eastern (Middle Eastern North African or Persian)|Oceanian|Native American|Other admixed ancestry	1318	NA	"Pharmacogenetic meta-analysis of baseline risk factors, pharmacodynamic, efficacy and tolerability endpoints from two large global cardiovascular outcomes trials for darapladib."	5/8/2020
GCST004961	28753643	Coronary Heart Disease	Major Coronary Event In Placebo-Treated Cardiovascular Disease (Time To Event)	Yeo A 2017	0.25	Asian unspecified|European|African American or Afro-Caribbean|Greater Middle Eastern (Middle Eastern North African or Persian)|Oceanian|Native American|Other admixed ancestry	1440	NA	"Pharmacogenetic meta-analysis of baseline risk factors, pharmacodynamic, efficacy and tolerability endpoints from two large global cardiovascular outcomes trials for darapladib."	5/8/2020
GCST004962	28753643	Coronary Heart Disease	Diarrhoea In Darapladib-Treated Cardiovascular Disease (Time To Event)	Yeo A 2017	0.25	European	481	NA	"Pharmacogenetic meta-analysis of baseline risk factors, pharmacodynamic, efficacy and tolerability endpoints from two large global cardiovascular outcomes trials for darapladib."	5/8/2020
GCST004964	28753643	Coronary Heart Disease	Myocardial Infarction In Darapladib-Treated Cardiovascular Disease (Time To Event)	Yeo A 2017	0.25	European|Asian unspecified|African American or Afro-Caribbean|Greater Middle Eastern (Middle Eastern North African or Persian)|Oceanian|Native American|Other admixed ancestry	740	NA	"Pharmacogenetic meta-analysis of baseline risk factors, pharmacodynamic, efficacy and tolerability endpoints from two large global cardiovascular outcomes trials for darapladib."	5/8/2020
GCST004967	28753643	Coronary Heart Disease	Moderate Or Severe Diarrhoea In Darapladib-Treated Cardiovascular Disease (Time To Event)	Yeo A 2017	0.25	European	212	NA	"Pharmacogenetic meta-analysis of baseline risk factors, pharmacodynamic, efficacy and tolerability endpoints from two large global cardiovascular outcomes trials for darapladib."	5/9/2020
GCST000125	18075462	Coronary Vasospasm	Coronary Spasm	Suzuki S 2007	NA	East Asian	100	311	A novel genetic marker for coronary spasm in women from a genome-wide single nucleotide polymorphism analysis.	5/7/2020
GCST003027	26169577	Cough	Cough In Response To Angiotensin-Converting Enzyme Inhibitor Drugs	Mosley JD 2015	14.6	European|African unspecified|Other	7080	5231	A genome-wide association study identifies variants in KCNIP4 associated with ACE inhibitor-induced cough.	5/8/2020
GCST90000255	32558485	Covid-19	Severe Covid-19 Infection With Respiratory Failure (Analysis I)	Ellinghaus D 2020	6592.794	European	3815	NA	Genomewide Association Study of Severe Covid-19 with Respiratory Failure.	6/26/2020
GCST90000256	32558485	Covid-19	Severe Covid-19 Infection With Respiratory Failure (Analysis Ii)	Ellinghaus D 2020	6592.794	European	3790	NA	Genomewide Association Study of Severe Covid-19 with Respiratory Failure.	6/26/2020
GCST010936	33307546	Covid-19	Covid-19 (Critical Illness Vs. Population)	Pairo-Castineira E 2020	2643.892	Hispanic or Latin American|European|South Asian	1170871	NA	Genetic mechanisms of critical illness in Covid-19.	1/10/2021
GCST90013414	33307546	Covid-19	Covid-19 (Critical Illness Vs. Population)	Pairo-Castineira E 2020	2643.892	European|South Asian|Hispanic or Latin American	10056	1160815	Genetic mechanisms of critical illness in Covid-19.	1/10/2021
GCST002729	25557950	Crohn's Disease	Crohn's Disease-Related Phenotypes	Alonso A 2015	10.75	European	1090	1296	Identification of risk loci for Crohn's disease phenotypes using a genome-wide association study.	5/8/2020
GCST008271	31043678	Crohn's Disease	Anti-Adalimumab Antibody Production In Response To Treatment In Crohn's Disease	Aterido A 2019	4.95	European	62	88	Genetic association between CD96 locus and immunogenicity to anti-TNF therapy in Crohn's disease.	5/10/2020
GCST000207	18587394	Crohn's Disease	Crohn's Disease	Barrett JC 2008	45.704	European	8059	5473	Genome-wide association defines more than 30 distinct susceptibility loci for Crohn's disease.	5/9/2020
GCST004132	28067908	Crohn's Disease	Crohn's Disease	de Lange KM 2017	141.6	European	40266	NA	Genome-wide association study implicates immune activation of multiple integrin genes in inflammatory bowel disease.	5/10/2020
GCST002017	23665963	Crohn's Disease	Crohn's Disease (Need For Surgery)	Dubinsky MC 2013	NA	European	624	NA	Multidimensional prognostic risk assessment identifies association between IL12B variation and surgery in Crohn's disease.	5/8/2020
GCST002018	23665963	Crohn's Disease	Crohn's Disease (Time To Surgery)	Dubinsky MC 2013	NA	European	983	NA	Multidimensional prognostic risk assessment identifies association between IL12B variation and surgery in Crohn's disease.	5/8/2020
GCST001473	22482804	Crohn's Disease	Crohn's Disease And Psoriasis	Ellinghaus D 2012	7.75	European	15131	17360	Combined analysis of genome-wide association studies for Crohn disease and psoriasis identifies seven shared susceptibility loci.	5/7/2020
GCST000212	18723019	Crohn's Disease	Crohn's Disease And Sarcoidosis (Combined)	Franke A 2008	NA	European	1174	2408	Genome-wide association analysis in sarcoidosis and Crohn's disease unravels a common susceptibility locus on 10p12.2.	5/7/2020
GCST000879	21102463	Crohn's Disease	Crohn's Disease	Franke A 2010	47.218	European	21389	30134	Genome-wide meta-analysis increases to 71 the number of confirmed Crohn's disease susceptibility loci.	5/8/2020
GCST008730	26278503	Crohn's Disease	Crohn's Disease	Huang C 2015	5.6	African American or Afro-Caribbean	2885	NA	Characterization of genetic loci that affect susceptibility to inflammatory bowel diseases in African Americans.	5/8/2020
GCST001729	23128233	Crohn's Disease	Crohn's Disease	Jostins L 2012	140.076	European	34366	42698	Host-microbe interactions have shaped the genetic architecture of inflammatory bowel disease.	5/8/2020
GCST001652	22936669	Crohn's Disease	Crohn's Disease	Julià A 2012	1.5	European	2765	2761	A genome-wide association study on a southern European population identifies a new Crohn's disease susceptibility locus at RBX1-EP300.	5/8/2020
GCST003360	26891255	Crohn's Disease	Crohn's Disease	Jung ES 2016	0.75	East Asian	2644	1308	HLA-C*01 is a Risk Factor for Crohn's Disease.	5/8/2020
GCST007216	30500874	Crohn's Disease	Crohn's Disease	Kakuta Y 2018	2	East Asian	2796	1622	A genome-wide association study identifying RAP1A as a novel susceptibility gene for Crohn's disease in Japanese individuals.	5/9/2020
