studyID	pubMedID	trait	reportedTrait	citation	altmetricScore	ethnicity	initialSampleSize	replicationSampleSize	title	lastUpdated
GCST002978	26084801	Metastasis Measurement	Metastasis At Diagnosis In Osteosarcoma	Mirabello L 2015	6.3	European|African unspecified|Hispanic or Latin American	541	394	A Genome-Wide Scan Identifies Variants in NFIB Associated with Metastasis in Patients with Osteosarcoma.	5/8/2020
GCST007434	30738427	Metastasis Measurement	Metastasis In Stage I-Iii Microsatellite Instability Low/Stable Colorectal Cancer (Time To Event)	Penney ME 2019	1.75	European	379	NA	A genome-wide association study identifies single nucleotide polymorphisms associated with time-to-metastasis in colorectal cancer.	5/9/2020
GCST003230	26586795	Metastasis Measurement	Survival In Colorectal Cancer (Distant Metastatic)	Phipps AI 2015	2	European	462	435	Common genetic variation and survival after colorectal cancer diagnosis: a genome-wide analysis.	5/8/2020
GCST003231	26586795	Metastasis Measurement	Survival In Colorectal Cancer (Non-Distant Metastatic)	Phipps AI 2015	2	European	2843	3205	Common genetic variation and survival after colorectal cancer diagnosis: a genome-wide analysis.	5/8/2020
GCST003057	26222057	Metastatic Colorectal Cancer	Progression Free Survival In Metastatic Colorectal Cancer (Chemotherapy Interaction)	Pander J 2015	2.85	European	520	NA	"Genome Wide Association Study for Predictors of Progression Free Survival in Patients on Capecitabine, Oxaliplatin, Bevacizumab and Cetuximab in First-Line Therapy of Metastatic Colorectal Cancer."	5/8/2020
GCST003058	26222057	Metastatic Colorectal Cancer	Progression Free Survival In Metastatic Colorectal Cancer (Capox-B Vs Capox-B Plus Cetuximab)	Pander J 2015	2.85	European	520	NA	"Genome Wide Association Study for Predictors of Progression Free Survival in Patients on Capecitabine, Oxaliplatin, Bevacizumab and Cetuximab in First-Line Therapy of Metastatic Colorectal Cancer."	5/8/2020
GCST007434	30738427	Metastatic Colorectal Cancer	Metastasis In Stage I-Iii Microsatellite Instability Low/Stable Colorectal Cancer (Time To Event)	Penney ME 2019	1.75	European	379	NA	A genome-wide association study identifies single nucleotide polymorphisms associated with time-to-metastasis in colorectal cancer.	5/9/2020
GCST001975	23594818	Methamphetamine-Induced Psychosis	Psychosis (Methamphetamine Induced)	Ikeda M 2013	3	East Asian	234	NA	Evidence for shared genetic risk between methamphetamine-induced psychosis and schizophrenia.	5/7/2020
GCST010298	32266521	Metopic Craniosynostosis	Metopic Nonsyndromic Craniosynostosis	Justice CM 2020	2.25	European	215	527	A genome-wide association study implicates the BMP7 locus as a risk factor for nonsyndromic metopic craniosynostosis.	7/22/2020
GCST010178	32121467	Migraine Disorder	Endometriosis Or Migraine	Adewuyi EO 2020	9.4	European|East Asian	411051	NA	Shared Molecular Genetic Mechanisms Underlie Endometriosis and Migraine Comorbidity.	7/10/2020
GCST000782	20802479	Migraine Disorder	Migraine	Anttila V 2010	36.424	European	13478	43264	Genome-wide association study of migraine implicates a common susceptibility variant on 8q22.1.	5/7/2020
GCST002078	23793025	Migraine Disorder	Migraine Without Aura	Anttila V 2013	134.306	European	76534	NA	Genome-wide meta-analysis identifies new susceptibility loci for migraine.	5/8/2020
GCST002079	23793025	Migraine Disorder	Migraine - Clinic-Based	Anttila V 2013	134.306	European	19147	NA	Genome-wide meta-analysis identifies new susceptibility loci for migraine.	5/8/2020
GCST002080	23793025	Migraine Disorder	Migraine With Aura	Anttila V 2013	134.306	European	79357	NA	Genome-wide meta-analysis identifies new susceptibility loci for migraine.	5/8/2020
GCST002081	23793025	Migraine Disorder	Migraine	Anttila V 2013	134.306	European	118710	NA	Genome-wide meta-analysis identifies new susceptibility loci for migraine.	5/8/2020
GCST007154	30266756	Migraine Disorder	Paediatric Migraine	Chang X 2018	41.95	African American or Afro-Caribbean|European	10435	4271	Common variants at 5q33.1 predispose to migraine in African-American children.	5/9/2020
GCST001105	21666692	Migraine Disorder	Migraine	Chasman DI 2011	56.5	European	23230	17720	Genome-wide association study reveals three susceptibility loci for common migraine in the general population.	5/7/2020
GCST001563	22683712	Migraine Disorder	Migraine	Freilinger T 2012	59	European	6906	5160	Genome-wide association analysis identifies susceptibility loci for migraine without aura.	5/9/2020
GCST003720	27322543	Migraine Disorder	Migraine	Gormley P 2016	1120.416	European	375752	NA	"Meta-analysis of 375,000 individuals identifies 38 susceptibility loci for migraine."	5/8/2020
GCST001019	21448238	Migraine Disorder	Migraine	Ligthart L 2011	NA	European	10980	8731	Meta-analysis of genome-wide association for migraine in six population-based European cohorts.	5/9/2020
GCST002080	23793025	Migraine With Aura	Migraine With Aura	Anttila V 2013	134.306	European	79357	NA	Genome-wide meta-analysis identifies new susceptibility loci for migraine.	5/8/2020
GCST002078	23793025	Migraine Without Aura	Migraine Without Aura	Anttila V 2013	134.306	European	76534	NA	Genome-wide meta-analysis identifies new susceptibility loci for migraine.	5/8/2020
GCST004900	28952330	Migraine Without Aura	Migraine Without Aura	Chen SP 2016	0.25	East Asian	2058	1724	Genome-wide association study identifies novel susceptibility loci for migraine in Han Chinese resided in Taiwan.	5/8/2020
GCST003721	27322543	Migraine Without Aura	Migraine Without Aura	Gormley P 2016	1120.416	European	147970	NA	"Meta-analysis of 375,000 individuals identifies 38 susceptibility loci for migraine."	5/8/2020
GCST002729	25557950	Mild Disease Course	Crohn's Disease-Related Phenotypes	Alonso A 2015	10.75	European	1090	1296	Identification of risk loci for Crohn's disease phenotypes using a genome-wide association study.	5/8/2020
GCST004408	28447399	Mild Neurocognitive Disorder	Hiv-Associated Neurocognitive Disorder (Mild Neurocognitive Disorder)	Jia P 2017	10.75	European|Hispanic or Latin American|African American or Afro-Caribbean	659	NA	Genome-wide association study of HIV-associated neurocognitive disorder (HAND): A CHARTER group study.	5/8/2020
GCST004411	28447399	Mild Neurocognitive Disorder	Hiv-Associated Neurocognitive Disorder (Mild Neurocognitive Disorder Or Asymptomatic Neurocognitive Impairment)	Jia P 2017	10.75	European|Hispanic or Latin American|African American or Afro-Caribbean	1018	NA	Genome-wide association study of HIV-associated neurocognitive disorder (HAND): A CHARTER group study.	5/10/2020
GCST003094	26301497	Mitral Valve Prolapse	Mitral Valve Prolapse	Dina C 2015	38.9	European	3881	8201	Genetic association analyses highlight biological pathways underlying mitral valve prolapse.	5/8/2020
GCST002672	25344690	Mmr-Related Febrile Seizures	Febrile Seizures	Feenstra B 2014	120.82	European	6117	3087	Common variants associated with general and MMR vaccine-related febrile seizures.	5/8/2020
GCST002674	25344690	Mmr-Related Febrile Seizures	Febrile Seizures (Mmr Vaccine-Related)	Feenstra B 2014	120.82	European	5047	2053	Common variants associated with general and MMR vaccine-related febrile seizures.	5/8/2020
GCST009281	31537649	Moderate Albuminuria	Microalbuminuria In Type 1 Diabetes	Salem RM 2019	92.622	European	14560	NA	Genome-Wide Association Study of Diabetic Kidney Disease Highlights Biology Involved in Glomerular Basement Membrane Collagen.	5/9/2020
GCST007022	30566433	Moderate Albuminuria	Type 2 Diabetes Nephropathy Including Microalbuminuria	Taira M 2018	2.25	East Asian	8401	4634	A variant within the FTO confers susceptibility to diabetic nephropathy in Japanese patients with type 2 diabetes.	5/8/2020
GCST008791	31511532	Moderate Albuminuria	Microalbuminuria	Teumer A 2019	31.05	European|South Asian|East Asian|African American or Afro-Caribbean|Hispanic or Latin American	348954	NA	Genome-wide association meta-analyses and fine-mapping elucidate pathways influencing albuminuria.	5/10/2020
GCST007537	30808802	Modic Type Vertebral Endplate Changes	Modic Changes	Freidin M 2019	1.5	European	1829	NA	Genome-wide meta-analysis identifies genetic locus on chromosome 9 associated with Modic changes.	5/9/2020
GCST002114	23918034	Molar-Incisor Hypomineralization	Molar-Incisor Hypomineralization	Kühnisch J 2013	NA	European	668	NA	Genome-wide association study (GWAS) for molar-incisor hypomineralization (MIH).	5/8/2020
GCST002922	26007630	Monoclonal Gammopathy	Multiple Myeloma And Monoclonal Gammopathy	Swaminathan B 2015	15.15	European	296835	2697	Variants in ELL2 influencing immunoglobulin levels associate with multiple myeloma.	5/8/2020
GCST007824	30737484	Monoclonal Gammopathy	Monoclonal Gammopathy Of Undetermined Significance	Thomsen H 2019	1	European	3902	NA	Genome-wide association study of monoclonal gammopathy of unknown significance (MGUS): comparison with multiple myeloma.	5/10/2020
GCST006420	30116032	Mood Disorder	Affective Disorder And Suicide Attempts	Erlangsen A 2018	11.9	European	17596	NA	Genetics of suicide attempts in individuals with and without mental disorders: a population-based genome-wide association study.	5/9/2020
GCST003800	27622933	Mood Disorder	Response To Bupropion In Depression	Li QS 2016	90.1	European	4536	NA	Analysis of 23andMe antidepressant efficacy survey data: implication of circadian rhythm and neuroplasticity in bupropion response.	5/8/2020
GCST007880	31085060	Mood Instability Measurement	Emotional Lability In Attention Deficit Hyperactivity Disorder	Gisbert L 2019	0.5	European	563	NA	Genome-wide analysis of emotional lability in adult attention deficit hyperactivity disorder (ADHD).	5/9/2020
GCST005078	27029810	Mortality	Mortality	Joshi PK 2016	182.146	European|African unspecified|African American or Afro-Caribbean|South Asian|East Asian	272081	27762	Variants near CHRNA3/5 and APOE have age- and sex-related effects on human lifespan.	5/9/2020
GCST000661	20400778	Mortality	Mortality In Heart Failure	Morrison AC 2010	NA	European|African unspecified	2992	NA	Genomic variation associated with mortality among adults of European and African ancestry with heart failure: the cohorts for heart and aging research in genomic epidemiology consortium.	5/10/2020
GCST003817	27639821	Mortality	Mortality In Sepsis	Scherag A 2016	19.95	European	740	2534	Genetic Factors of the Disease Course after Sepsis: A Genome-Wide Study for 28Day Mortality.	5/8/2020
GCST003539	27149122	Mortality	Mortality In Heart Failure	Smith JG 2016	15.25	European	2828	1870	Discovery of Genetic Variation on Chromosome 5q22 Associated with Mortality in Heart Failure.	5/8/2020
GCST003421	27064253	Mosaic Loss Of Chromosome Y Measurement	Mosaic Loss Of Chromosome Y	Zhou W 2016	48.45	European|African unspecified	12369	NA	Mosaic loss of chromosome Y is associated with common variation near TCL1A.	5/8/2020
GCST010322	32355309	Motor Function Measurement	Levodopa Wearing Off Effect (Time Symptoms Uncontrolled) In Parkinson's Disease (Response To Zonisamide)	Cha PC 2020	2.25	East Asian	200	NA	Genome-wide association study identifies zonisamide responsive gene in Parkinson's disease patients.	7/24/2020
GCST010323	32355309	Motor Function Measurement	Levodopa Wearing Off Effect (Motor Symptom Score Change) In Parkinson's Disease (Response To Zonisamide)	Cha PC 2020	2.25	East Asian	200	NA	Genome-wide association study identifies zonisamide responsive gene in Parkinson's disease patients.	7/24/2020
GCST005575	29273593	Moyamoya Disease	Moyamoya Disease	Duan L 2017	3.25	East Asian	2786	3767	Novel Susceptibility Loci for Moyamoya Disease Revealed by a Genome-Wide Association Study.	5/8/2020
GCST000860	21048783	Moyamoya Disease	Moyamoya Disease	Kamada F 2010	3.25	East Asian	117	108	A genome-wide association study identifies RNF213 as the first Moyamoya disease gene.	5/8/2020
GCST000314	19132087	Mucocutaneous Lymph Node Syndrome	Kawasaki Disease	Burgner D 2009	3	European	241	2523	A genome-wide association study identifies novel and functionally related susceptibility Loci for Kawasaki disease.	5/7/2020
GCST001322	22081228	Mucocutaneous Lymph Node Syndrome	Kawasaki Disease	Khor CC 2011	3.75	Other|European|East Asian	6657	5774	Genome-wide association study identifies FCGR2A as a susceptibility locus for Kawasaki disease.	5/7/2020
GCST000939	21221998	Mucocutaneous Lymph Node Syndrome	Kawasaki Disease	Kim JJ 2011	NA	East Asian	786	1556	A genome-wide association analysis reveals 1p31 and 2p13.3 as susceptibility loci for Kawasaki disease.	5/7/2020
GCST002026	23677057	Mucocutaneous Lymph Node Syndrome	Coronary Arterial Lesions In Patients With Kawasaki Disease	Kim JJ 2013	NA	East Asian	140	223	Identification of KCNN2 as a susceptibility locus for coronary artery aneurysms in Kawasaki disease using genome-wide association analysis.	5/8/2020
GCST008314	30971808	Mucocutaneous Lymph Node Syndrome	Response To Intravenous Immunoglobulin Treatment In Kawasaki Disease	Kim JJ 2019	0.75	East Asian	296	1242	Identification of SAMD9L as a susceptibility locus for intravenous immunoglobulin resistance in Kawasaki disease by genome-wide association analysis.	5/9/2020
GCST003560	27171184	Mucocutaneous Lymph Node Syndrome	Coronary Artery Aneurysm In Kawasaki Disease	Kuo HC 2016	0.5	East Asian	157	NA	Genome-Wide Association Study Identifies Novel Susceptibility Genes Associated with Coronary Artery Aneurysm Formation in Kawasaki Disease.	5/10/2020
GCST004859	28886140	Mucocutaneous Lymph Node Syndrome	Kawasaki Disease	Kwon YC 2017	1	East Asian	1249	5861	Male-specific association of the FCGR2A His167Arg polymorphism with Kawasaki disease.	5/8/2020
GCST007192	30267110	Mucocutaneous Lymph Node Syndrome	Coronary Artery Aneurysm In Kawasaki Disease	Kwon YC 2018	0.25		248	544	Identification of the TIFAB Gene as a Susceptibility Locus for Coronary Artery Aneurysm in Patients with Kawasaki Disease.	5/9/2020
GCST001456	22446961	Mucocutaneous Lymph Node Syndrome	Kawasaki Disease	Lee YC 2012	0.5	East Asian	1729	811	Two new susceptibility loci for Kawasaki disease identified through genome-wide association analysis.	5/8/2020
GCST001455	22446962	Mucocutaneous Lymph Node Syndrome	Kawasaki Disease	Onouchi Y 2012	2.25	East Asian	3807	1701	A genome-wide association study identifies three new risk loci for Kawasaki disease.	5/8/2020
GCST000962	21326860	Mucocutaneous Lymph Node Syndrome	Kawasaki Disease	Tsai FJ 2011	0.25	East Asian	696	574	Identification of novel susceptibility Loci for kawasaki disease in a Han chinese population by a genome-wide association study.	5/9/2020
GCST007280	30760885	Multiple Births Measurement	Number Of Twin Births	Mbarek H 2019	13.85	European	418553	NA	Biological insights into multiple birth: genetic findings from UK Biobank.	5/9/2020
GCST001331	22120009	Multiple Myeloma	Multiple Myeloma	Broderick P 2011	3.25	European	7578	1096	Common variation at 3p22.1 and 7p15.3 influences multiple myeloma risk.	5/7/2020
GCST003964	28317148	Multiple Myeloma	Bortezomib-Induced Peripheral Neuropathy In Multiple Myeloma	Campo C 2016	0.5	European	646	NA	Bortezomib-induced peripheral neuropathy: A genome-wide association study on multiple myeloma patients.	5/8/2020
GCST002140	23955597	Multiple Myeloma	Multiple Myeloma	Chubb D 2013	112.25	European	9641	6041	"Common variation at 3q26.2, 6p21.33, 17p11.2 and 22q13.1 influences multiple myeloma risk."	5/8/2020
GCST009680	31935283	Multiple Myeloma	Multiple Myeloma	Du Z 2020	0.75	African American or Afro-Caribbean|African unspecified	10684	NA	A meta-analysis of genome-wide association studies of multiple myeloma among men and women of African ancestry.	5/10/2020
GCST004483	27363682	Multiple Myeloma	Multiple Myeloma	Mitchell JS 2016	41.05	European	241704	7350	Genome-wide association study identifies multiple susceptibility loci for multiple myeloma.	5/10/2020
GCST002921	26007630	Multiple Myeloma	Multiple Myeloma	Swaminathan B 2015	15.15	European	224749	2697	Variants in ELL2 influencing immunoglobulin levels associate with multiple myeloma.	5/8/2020
GCST002922	26007630	Multiple Myeloma	Multiple Myeloma And Monoclonal Gammopathy	Swaminathan B 2015	15.15	European	296835	2697	Variants in ELL2 influencing immunoglobulin levels associate with multiple myeloma.	5/8/2020
GCST001906	23502783	Multiple Myeloma	Multiple Myeloma (Igh Translocation)	Weinhold N 2013	16.3	European	8966	NA	The CCND1 c.870G>A polymorphism is a risk factor for t(11;14)(q13;q32) multiple myeloma.	5/7/2020
GCST001907	23502783	Multiple Myeloma	Multiple Myeloma (Hyperdiploidy)	Weinhold N 2013	16.3	European	8966	NA	The CCND1 c.870G>A polymorphism is a risk factor for t(11;14)(q13;q32) multiple myeloma.	5/8/2020
GCST006432	30213928	Multiple Myeloma	Multiple Myeloma	Went M 2018	30.8	European	249665	7865	Identification of multiple risk loci and regulatory mechanisms influencing susceptibility to multiple myeloma.	5/9/2020
GCST003051	26198393	Multiple Myeloma	Multiple Myeloma (Survival)	Ziv E 2015	12.25	European|African American or Afro-Caribbean|Other|Hispanic or Latin American	545	1090	Genome-wide association study identifies variants at 16p13 associated with survival in multiple myeloma patients.	5/8/2020
GCST003566	27386562	Multiple Sclerosis	Multiple Sclerosis	Andlauer TF 2016	166.43	European	15283	6226	Novel multiple sclerosis susceptibility loci implicated in epigenetic regulation.	5/9/2020
GCST000263	18997785	Multiple Sclerosis	Multiple Sclerosis	Aulchenko YS 2008	4	European	240	6320	Genetic variation in the KIF1B locus influences susceptibility to multiple sclerosis.	5/8/2020
GCST000425	19525955	Multiple Sclerosis	Multiple Sclerosis	Bahlo M 2009	4	European	5031	4566	Genome-wide association study identifies new multiple sclerosis susceptibility loci on chromosomes 12 and 20.	5/7/2020
GCST005531	24076602	Multiple Sclerosis	Multiple Sclerosis	Beecham AH 2013	181.516	European	38589	41505	Analysis of immune-related loci identifies 48 new susceptibility variants for multiple sclerosis.	5/8/2020
GCST001096	21654844	Multiple Sclerosis	Multiple Sclerosis	Briggs FB 2011	2	European	1470	NA	Genome-wide association study of severity in multiple sclerosis.	5/7/2020
GCST005706	29521573	Multiple Sclerosis	Neutralising Antibody Response To Interferon Beta Therapy In Multiple Sclerosis (Presence Of Antibodies)	Buck D 2018	1.75	European|Hispanic or Latin American|Asian unspecified|African unspecified	941	NA	Effect of HLA-DRB1 alleles and genetic variants on the development of neutralizing antibodies to interferon beta in the BEYOND and BENEFIT trials.	5/9/2020
GCST003193	26644207	Multiple Sclerosis	Response To Interferon Beta In Multiple Sclerosis	Clarelli F 2015	5.75	European	337	NA	Pharmacogenetic study of long-term response to interferon-β treatment in multiple sclerosis.	5/8/2020
GCST000252	18941528	Multiple Sclerosis	Multiple Sclerosis	Comabella M 2008	4	European	484	1586	"Identification of a novel risk locus for multiple sclerosis at 13q31.3 by a pooled genome-wide scan of 500,000 single nucleotide polymorphisms."	5/7/2020
GCST000424	19525953	Multiple Sclerosis	Multiple Sclerosis	De Jager PL 2009	6	European	9844	4331	"Meta-analysis of genome scans and replication identify CD6, IRF8 and TNFRSF1A as new multiple sclerosis susceptibility loci."	5/9/2020
GCST009560	31289819	Multiple Sclerosis	Decreased Low Contrast Letter Acuity In Multiple Sclerosis	Fitzgerald KC 2019	69.15	European	582	253	Early complement genes are associated with visual system degeneration in multiple sclerosis.	5/10/2020
GCST002758	25616667	Multiple Sclerosis	Oligoclonal Band Status In Multiple Sclerosis	Goris A 2015	20.254	European	3026	3478	Genetic variants are major determinants of CSF antibody levels in multiple sclerosis.	5/8/2020
GCST000062	17660530	Multiple Sclerosis	Multiple Sclerosis	Hafler DA 2007	32.858	European	3362	5918	Risk alleles for multiple sclerosis identified by a genomewide study.	5/10/2020
GCST009597	31604244	Multiple Sclerosis	Multiple Sclerosis	International Multiple Sclerosis Genetics Consortium 2019	319.954	European	41505	74299	Multiple sclerosis genomic map implicates peripheral immune cells and microglia in susceptibility.	5/10/2020
GCST000593	20159113	Multiple Sclerosis	Multiple Sclerosis	Jakkula E 2010	NA	European	204	14713	Genome-wide association study in a high-risk isolate for multiple sclerosis reveals associated variants in STAT3 gene.	5/8/2020
GCST001459	22457343	Multiple Sclerosis	Multiple Sclerosis	Martinelli-Boneschi F 2012	0.5	European	431	777	A genome-wide association study in progressive multiple sclerosis.	5/7/2020
GCST001505	22570697	Multiple Sclerosis	Multiple Sclerosis	Matesanz F 2012	6.8	European	6685	5725	Genome-wide association study of multiple sclerosis confirms a novel locus at 5p13.1.	5/8/2020
GCST000716	20598377	Multiple Sclerosis	Multiple Sclerosis	Nischwitz S 2010	NA	European	1415	NA	Evidence for VAV2 and ZNF433 as susceptibility genes for multiple sclerosis.	5/7/2020
GCST001341	22190364	Multiple Sclerosis	Multiple Sclerosis	Patsopoulos NA 2011	0.75	European	17698	NA	Genome-wide meta-analysis identifies novel multiple sclerosis susceptibility loci.	5/9/2020
GCST000680	20453840	Multiple Sclerosis	Multiple Sclerosis	Sanna S 2010	2	European	1754	3780	Variants within the immunoregulatory CBLB gene are associated with multiple sclerosis.	5/7/2020
GCST001198	21833088	Multiple Sclerosis	Multiple Sclerosis	Sawcer S 2011	107.99	European	26621	11514	Genetic risk and a primary role for cell-mediated immune mechanisms in multiple sclerosis.	5/9/2020
GCST004290	28445677	Multiple Sclerosis	Multiple Sclerosis	Steri M 2017	212.704	European	4421	20923	Overexpression of the Cytokine BAFF and Autoimmunity Risk.	5/8/2020
GCST004752	28739605	Multiple Sclerosis	Relapse In Multiple Sclerosis	Zhou Y 2017	11.65		268	181	Genetic variation in the gene LRP2 increases relapse risk in multiple sclerosis.	5/8/2020
GCST003784	27629089	Multiple System Atrophy	Multiple System Atrophy	Sailer A 2016	3.5	European	4782	NA	A genome-wide association study in multiple system atrophy.	5/8/2020
GCST002838	25643325	Myasthenia Gravis	Myasthenia Gravis	Renton AE 2015	17.25	European	2949	890	A genome-wide association study of myasthenia gravis.	5/8/2020
GCST009516	31738830	Myelodysplastic Syndrome	Non-Del(5q) Myelodysplastic Syndromes	McGraw KL 2019	0.5	European	6512	NA	Non-del(5q) myelodysplastic syndromes-associated loci detected by SNP-array genome-wide association meta-analysis.	5/10/2020
GCST90000032	33057200	Myeloproliferative Disorder	Myeloproliferative Neoplasms	Bao EL 2020	123.666	European	585140	NA	Inherited myeloproliferative neoplasm risk affects haematopoietic stem cells.	11/5/2020
GCST002840	25849990	Myeloproliferative Disorder	Myeloproliferative Neoplasms	Tapper W 2015	10.25	European	3200	12028	"Genetic variation at MECOM, TERT, JAK2 and HBS1L-MYB predisposes to myeloproliferative neoplasms."	5/8/2020
GCST003430	26950853	Myocardial Infarction	Incident Myocardial Infarction	Dehghan A 2016	5.6	European|African American or Afro-Caribbean	23188	45762	Genome-Wide Association Study for Incident Myocardial Infarction and Coronary Heart Disease in Prospective Cohort Studies: The CHARGE Consortium.	5/8/2020
GCST000030	17478679	Myocardial Infarction	Myocardial Infarction	Helgadottir A 2007	86.194	European	8335	9289	A common variant on chromosome 9p21 affects the risk of myocardial infarction.	5/7/2020
GCST002475	24916648	Myocardial Infarction	Myocardial Infarction	Hirokawa M 2014	0.5	East Asian	4864	39809	A genome-wide association study identifies PLCL2 and AP3D1-DOT1L-SF3A2 as new susceptibility loci for myocardial infarction in Japanese.	5/8/2020
GCST000340	19198609	Myocardial Infarction	Myocardial Infarction (Early Onset)	Kathiresan S 2009	92.362	European	6042	19492	Genome-wide association of early-onset myocardial infarction with single nucleotide polymorphisms and copy number variants.	5/8/2020
GCST003117	26343387	Myocardial Infarction	Myocardial Infarction	Nikpay M 2015	198.786	African American or Afro-Caribbean|Hispanic or Latin American|South Asian|Greater Middle Eastern (Middle Eastern North African or Persian)|East Asian|European	166459	NA	"A comprehensive 1,000 Genomes-based genome-wide association meta-analysis of coronary artery disease."	5/8/2020
GCST000946	21239051	Myocardial Infarction	Myocardial Infarction In Coronary Artery Disease	Reilly MP 2011	5	European	7311	2116	Identification of ADAMTS7 as a novel locus for coronary atherosclerosis and association of ABO with myocardial infarction in the presence of coronary atherosclerosis: two genome-wide association studies.	5/8/2020
GCST003471	26708285	Myocardial Infarction	Myocardial Infarction	Wakil SM 2016	167	Greater Middle Eastern (Middle Eastern North African or Persian)	4431	1237	A genome-wide association study reveals susceptibility loci for myocardial infarction/coronary artery disease in Saudi Arabs.	5/8/2020
GCST010476	30226566	Myocardial Infarction	Myocardial Infarction	Yamada Y 2018	1	East Asian	6926	NA	"Identification of 13 novel susceptibility loci for early-onset myocardial infarction, hypertension, or chronic kidney disease."	9/1/2020
GCST004964	28753643	Myocardial Infarction	Myocardial Infarction In Darapladib-Treated Cardiovascular Disease (Time To Event)	Yeo A 2017	0.25	European|Asian unspecified|African American or Afro-Caribbean|Greater Middle Eastern (Middle Eastern North African or Persian)|Oceanian|Native American|Other admixed ancestry	740	NA	"Pharmacogenetic meta-analysis of baseline risk factors, pharmacodynamic, efficacy and tolerability endpoints from two large global cardiovascular outcomes trials for darapladib."	5/8/2020
GCST009817	32066683	Myocarditis	Clozapine-Induced Myocarditis In Schizophrenia	Lacaze P 2020	NA	European	95	NA	Genetic associations with clozapine-induced myocarditis in patients with schizophrenia.	5/10/2020
GCST009962	31816047	Myopia	High Myopia	Boutin TS 2019	14.33	European	50372	NA	Insights into the genetic basis of retinal detachment.	5/13/2020
