studyID	pubMedID	trait	reportedTrait	citation	altmetricScore	ethnicity	initialSampleSize	replicationSampleSize	title	lastUpdated
GCST001346	22142827	Response To Gemcitabine	Response To Gemcitabine In Pancreatic Cancer	Innocenti F 2011	0.5	European	294	NA	A genome-wide association study of overall survival in pancreatic cancer patients treated with gemcitabine in CALGB 80303.	5/8/2020
GCST001390	22293537	Response To Gemcitabine	Response To Gemcitabine In Pancreatic Cancer	Kiyotani K 2012	3.5	East Asian	79	95	A genome-wide association study identifies four genetic markers for hematological toxicities in cancer patients receiving gemcitabine therapy.	5/7/2020
GCST002003	23648065	Response To Gemcitabine	Adverse Response To Chemotherapy (Neutropenia/Leucopenia) (Gemcitabine)	Low SK 2013	3	East Asian	306	NA	Genome-wide association study of chemotherapeutic agent-induced severe neutropenia/leucopenia for patients in Biobank Japan.	5/8/2020
GCST003081	26265699	Response To Glucocorticoid	Glucocorticoid-Induced Osteonecrosis (Age 10 Years And Older)	Karol SE 2015	4.6	African American or Afro-Caribbean|European|Hispanic or Latin American|East Asian	1468	NA	Genetics of glucocorticoid-associated osteonecrosis in children with acute lymphoblastic leukemia.	5/8/2020
GCST003083	26265699	Response To Glucocorticoid	Glucocorticoid-Induced Osteonecrosis (Time Dependent Analysis)	Karol SE 2015	4.6	European|African American or Afro-Caribbean|Hispanic or Latin American|East Asian	2285	NA	Genetics of glucocorticoid-associated osteonecrosis in children with acute lymphoblastic leukemia.	5/9/2020
GCST003178	26460308	Response To Immunochemotherapy	Event Free Survival In Diffuse Large B-Cell Lymphoma Treated With Immunochemotherapy	Ghesquieres H 2015	5.6	European	852	685	Genome-Wide Association Study of Event-Free Survival in Diffuse Large B-Cell Lymphoma Treated With Immunochemotherapy.	5/9/2020
GCST003824	27723809	Response To Interferon	Depression In Response To Interferon-Based Therapy In Chronic Hepatitis C	Matsunami K 2016	0.5	East Asian	224	160	Genome-Wide Association Study Identifies ZNF354C Variants Associated with Depression from Interferon-Based Therapy for Chronic Hepatitis C.	5/8/2020
GCST004160	28163062	Response To Interferon	Hepatocellular Carcinoma In Post Hepatitis C Eradication By Interferon Therapy	Matsuura K 2017	21.25	East Asian	461	345	Genome-Wide Association Study Identifies TLL1 Variant Associated With Development of Hepatocellular Carcinoma After Eradication of Hepatitis C Virus Infection.	5/8/2020
GCST005706	29521573	Response To Interferon Beta	Neutralising Antibody Response To Interferon Beta Therapy In Multiple Sclerosis (Presence Of Antibodies)	Buck D 2018	1.75	European|Hispanic or Latin American|Asian unspecified|African unspecified	941	NA	Effect of HLA-DRB1 alleles and genetic variants on the development of neutralizing antibodies to interferon beta in the BEYOND and BENEFIT trials.	5/9/2020
GCST003193	26644207	Response To Interferon Beta	Response To Interferon Beta In Multiple Sclerosis	Clarelli F 2015	5.75	European	337	NA	Pharmacogenetic study of long-term response to interferon-β treatment in multiple sclerosis.	5/8/2020
GCST008314	30971808	Response To Intravenous Immunoglobulin Therapy	Response To Intravenous Immunoglobulin Treatment In Kawasaki Disease	Kim JJ 2019	0.75	East Asian	296	1242	Identification of SAMD9L as a susceptibility locus for intravenous immunoglobulin resistance in Kawasaki disease by genome-wide association analysis.	5/9/2020
GCST001558	22664479	Response To Irinotecan	Response To Irinotecan In Non-Small-Cell Lung Cancer	Han JY 2012	4		101	146	A genome-wide association study for irinotecan-related severe toxicities in patients with advanced non-small-cell lung cancer.	5/9/2020
GCST001901	23478653	Response To Irinotecan	Response To Irinotecan And Platinum-Based Chemotherapy In Non-Small-Cell Lung Cancer	Han JY 2013	NA		139	NA	A genome-wide association study of survival in small-cell lung cancer patients treated with irinotecan plus cisplatin chemotherapy.	5/8/2020
GCST006567	30009487	Response To Ketogenic Diet	Response To Ketogenic Dietary Therapies In Epilepsy	Schoeler NE 2018	16.8		235	NA	Genome-wide association study: Exploring the genetic basis for responsiveness to ketogenic dietary therapies for drug-resistant epilepsy.	5/9/2020
GCST002949	26220383	Response To Lamotrigine	Epilepsy And Lamotrigine-Induced Maculopapular Eruptions	Jang HW 2015	1.25	East Asian	1114	NA	GWAS identifies two susceptibility loci for lamotrigine-induced skin rash in patients with epilepsy.	5/8/2020
GCST010322	32355309	Response To Levodopa	Levodopa Wearing Off Effect (Time Symptoms Uncontrolled) In Parkinson's Disease (Response To Zonisamide)	Cha PC 2020	2.25	East Asian	200	NA	Genome-wide association study identifies zonisamide responsive gene in Parkinson's disease patients.	7/24/2020
GCST010323	32355309	Response To Levodopa	Levodopa Wearing Off Effect (Motor Symptom Score Change) In Parkinson's Disease (Response To Zonisamide)	Cha PC 2020	2.25	East Asian	200	NA	Genome-wide association study identifies zonisamide responsive gene in Parkinson's disease patients.	7/24/2020
GCST003378	26806518	Response To Lithium Ion	Response To Lithium Treatment In Bipolar Disorder	Hou L 2016	178.928	European|East Asian	2563	NA	Genetic variants associated with response to lithium treatment in bipolar disorder: a genome-wide association study.	5/8/2020
GCST003158	26503763	Response To Lithium Ion	Subjective Response To Lithium Treatment	Song J 2015	13.25	European	10538	NA	Genome-wide association study identifies SESTD1 as a novel risk gene for lithium-responsive bipolar disorder.	5/8/2020
GCST003159	26503763	Response To Lithium Ion	Objective Response To Lithium Treatment	Song J 2015	13.25	European	7007	NA	Genome-wide association study identifies SESTD1 as a novel risk gene for lithium-responsive bipolar disorder.	5/8/2020
GCST003160	26503763	Response To Lithium Ion	Subjective Response To Lithium Treatment In Bipolar Disorder	Song J 2015	13.25	European	2698	NA	Genome-wide association study identifies SESTD1 as a novel risk gene for lithium-responsive bipolar disorder.	5/8/2020
GCST003161	26503763	Response To Lithium Ion	Objective Response To Lithium Treatment In Bipolar Disorder	Song J 2015	13.25	European	1176	NA	Genome-wide association study identifies SESTD1 as a novel risk gene for lithium-responsive bipolar disorder.	5/8/2020
GCST006055	24847101	Response To Long-Chain N-3 Pufa Dietary Supplementation	Response To Long-Chain N-3 Polyunsaturated Fatty Acid Supplementation (Change In Triglyceride Levels)	Rudkowska I 2014	4.35		141	NA	Genome-wide association study of the plasma triglyceride response to an n-3 polyunsaturated fatty acid supplementation.	5/9/2020
GCST000927	21186350	Response To Metformin	Response To Metformin In Type 2 Diabetes (Glycemic)	Zhou K 2010	2	European	1024	2896	Common variants near ATM are associated with glycemic response to metformin in type 2 diabetes.	5/7/2020
GCST002375	24583629	Response To Methotrexate	Response To Methotrexate In Rheumatoid Arthritis	Senapati S 2014	0.5	South Asian	438	NA	Genome-wide analysis of methotrexate pharmacogenomics in rheumatoid arthritis shows multiple novel risk variants and leads for TYMS regulation.	5/8/2020
GCST002263	24236485	Response To Non-Steroidal Anti-Inflammatory	Acute Urticaria And Angioedema (Non-Steroidal Anti-Inflammatory Drug-Induced)	Cornejo-García JA 2013	NA	European|East Asian	457	NA	Genome-wide association study in NSAID-induced acute urticaria/angioedema in Spanish and Han Chinese populations.	5/8/2020
GCST002179	24025145	Response To Paclitaxel	Adverse Response To Chemotherapy In Breast Cancer (Alopecia) (Paclitaxel)	Chung S 2013	11	East Asian	120	NA	A genome-wide association study of chemotherapy-induced alopecia in breast cancer patients.	5/8/2020
GCST002074	23776197	Response To Paclitaxel	Paclitaxel-Induced Neuropathy	Leandro-García LJ 2013	5.024	European	143	NA	Genome-wide association study identifies ephrin type A receptors implicated in paclitaxel induced peripheral sensory neuropathy.	5/8/2020
GCST001999	23648065	Response To Paclitaxel	Adverse Response To Chemotherapy (Neutropenia/Leucopenia) (Paclitaxel)	Low SK 2013	3	East Asian	582	NA	Genome-wide association study of chemotherapeutic agent-induced severe neutropenia/leucopenia for patients in Biobank Japan.	5/8/2020
GCST002006	23648065	Response To Paclitaxel	Adverse Response To Chemotherapy (Neutropenia/Leucopenia) (Paclitaxel + Carboplatin)	Low SK 2013	3	East Asian	316	NA	Genome-wide association study of chemotherapeutic agent-induced severe neutropenia/leucopenia for patients in Biobank Japan.	5/8/2020
GCST003232	26546620	Response To Pazopanib	Response To Pazopanib In Cancer (Hepatotoxicity)	Xu CF 2015	7.58	European|Asian unspecified|Other	1188	1002	HLA-B*57:01 Confers Susceptibility to Pazopanib-Associated Liver Injury in Patients with Cancer.	5/8/2020
GCST005200	29288229	Response To Phenytoin	Phenytoin-Induced Maculopapular Exanthema	McCormack M 2017	38.2	European|East Asian	604	101	Genetic variation in CFH predicts phenytoin-induced maculopapular exanthema in European-descent patients.	5/8/2020
GCST004961	28753643	Response To Placebo	Major Coronary Event In Placebo-Treated Cardiovascular Disease (Time To Event)	Yeo A 2017	0.25	Asian unspecified|European|African American or Afro-Caribbean|Greater Middle Eastern (Middle Eastern North African or Persian)|Oceanian|Native American|Other admixed ancestry	1440	NA	"Pharmacogenetic meta-analysis of baseline risk factors, pharmacodynamic, efficacy and tolerability endpoints from two large global cardiovascular outcomes trials for darapladib."	5/8/2020
GCST004097	28120872	Response To Platinum-Based Neoadjuvant Chemotherapy	Response To Platinum-Based Neoadjuvant Chemotherapy In Cervical Cancer	Li X 2017	1	East Asian	226	370	Genome-wide association study identifies four SNPs associated with response to platinum-based neoadjuvant chemotherapy for cervical cancer.	5/8/2020
GCST001629	22872573	Response To Platinum Based Chemotherapy	Response To Platinum-Based Chemotherapy In Non-Small-Cell Lung Cancer	Hu L 2012	1	East Asian|European	528	749	Genome-wide association study of prognosis in advanced non-small cell lung cancer patients receiving platinum-based chemotherapy.	5/7/2020
GCST001998	23648065	Response To Platinum Based Chemotherapy	Adverse Response To Chemotherapy (Neutropenia/Leucopenia) (All Platinum-Based Drugs)	Low SK 2013	3	East Asian	1171	NA	Genome-wide association study of chemotherapeutic agent-induced severe neutropenia/leucopenia for patients in Biobank Japan.	5/8/2020
GCST009642	31779001	Response To Polyunsaturated Fatty Acid Supplementation	Impaired Insulin Sensitivity In Response To N-3 Pufa Supplementation	Franck M 2019	1.5	European	138	NA	Prevention of Potential Adverse Metabolic Effects of a Supplementation with Omega-3 Fatty Acids Using a Genetic Score Approach.	5/10/2020
GCST003581	27515689	Response To Radiation	Toxicity Response To Radiotherapy In Prostate Cancer (Decreased Urine Stream) (Time To Event)	Kerns SL 2016	70.05	European	1245	NA	Meta-analysis of Genome Wide Association Studies Identifies Genetic Markers of Late Toxicity Following Radiotherapy for Prostate Cancer.	5/8/2020
GCST003582	27515689	Response To Radiation	"Response To Radiotherapy In Prostate Cancer (Toxicity, Urinary Frequency)"	Kerns SL 2016	70.05	European	1409	NA	Meta-analysis of Genome Wide Association Studies Identifies Genetic Markers of Late Toxicity Following Radiotherapy for Prostate Cancer.	5/8/2020
GCST003584	27515689	Response To Radiation	"Response To Radiotherapy In Prostate Cancer (Toxicity, Rectal Bleeding)"	Kerns SL 2016	70.05	European	1487	NA	Meta-analysis of Genome Wide Association Studies Identifies Genetic Markers of Late Toxicity Following Radiotherapy for Prostate Cancer.	5/8/2020
GCST008378	31095341	Response To Radiation	Toxicity Response To Radiotherapy In Prostate Cancer (Decreased Urine Stream) (Time To Event)	Kerns SL 2019	25.9	European	3470	NA	Radiogenomics Consortium Genome-Wide Association Study Meta-analysis of Late Toxicity after Prostate Cancer Radiotherapy.	5/10/2020
GCST008380	31095341	Response To Radiation	Toxicity Response To Radiotherapy In Prostate Cancer (Hematuria) (Time To Event)	Kerns SL 2019	25.9	European|East Asian	3619	538	Radiogenomics Consortium Genome-Wide Association Study Meta-analysis of Late Toxicity after Prostate Cancer Radiotherapy.	5/10/2020
GCST008381	31095341	Response To Radiation	Toxicity Response To Radiotherapy In Prostate Cancer (Rectal Bleeding) (Time To Event)	Kerns SL 2019	25.9	European	3379	NA	Radiogenomics Consortium Genome-Wide Association Study Meta-analysis of Late Toxicity after Prostate Cancer Radiotherapy.	5/10/2020
GCST008388	31196165	Response To Radiation	Acute Post-Radiotherapy Pain In Breast Cancer	Lee E 2019	0.5	Hispanic or Latin American|European|African unspecified|African American or Afro-Caribbean|Other	1144	NA	Genome-wide enriched pathway analysis of acute post-radiotherapy pain in breast cancer patients: a prospective cohort study.	5/10/2020
GCST005112	29059430	Response To Radiation	Breast Cancer In Childhood Cancer Survivors Treated With More Than 10 Gray Radiotherapy	Morton LM 2017	16.5	European	624	NA	Genome-Wide Association Study to Identify Susceptibility Loci That Modify Radiation-Related Risk for Breast Cancer After Childhood Cancer.	5/9/2020
GCST007200	30299488	Response To Radiation	Radiation-Induced Brain Injury In Nasopharyngeal Carcinoma	Wang TM 2018	2.25		1082	1860	Genome-Wide Association Study of Susceptibility Loci for Radiation-Induced Brain Injury.	5/9/2020
GCST002900	25963547	Response To Radiation	Obesity In Adult Survivors Of Childhood Cancer Exposed To Cranial Radiation	Wilson CL 2015	86.678	European|African unspecified	776	NA	Genetic and clinical factors associated with obesity among adult survivors of childhood cancer: A report from the St. Jude Lifetime Cohort.	5/7/2020
GCST010511	32503578	Response To Radiation	Response To Radiotherapy In Nasopharyngeal Carcinoma (Acute Oral Mucositis)	Yang DW 2020	7.55	East Asian	1467	NA	Genome-wide association study identifies genetic susceptibility loci and pathways of radiation-induced acute oral mucositis.	9/10/2020
GCST006277	30054556	Response To Ranibizumab	Response To Ranibizumab In Age-Related Macular Degeneration (Exudative)	Akiyama M 2018	0.25	East Asian	434	485	Genome-wide association study suggests four variants influencing outcomes with ranibizumab therapy in exudative age-related macular degeneration.	5/9/2020
GCST002691	25670933	Response To Red Blood Cell Transfusion	Alloimmunization Response To Red Blood Cell Transfusion In Sickle Cell Anemia	Hanchard NA 2014	0.5	African American or Afro-Caribbean	94	NA	A Genome-Wide Screen for Large-Effect Alloimmunization Susceptibility Loci among Red Blood Cell Transfusion Recipients with Sickle Cell Disease.	5/8/2020
GCST007210	30578281	Response To Red Blood Cell Transfusion	Alloimmunization Response To Red Blood Cell Transfusion In Sickle Cell Anemia	Williams LM 2018	7.2	African American or Afro-Caribbean	267	130	A locus on chromosome 5 shows African ancestry-limited association with alloimmunization in sickle cell disease.	5/9/2020
GCST004114	28062682	Response To Reverse Transcriptase Inhibitor	Nevirapine-Induced Hypersensitivity In Hiv (Drug-Induced Liver Injury)	Carr DF 2017	1	Sub-Saharan African|African unspecified	203	111	Genome-wide association study of nevirapine hypersensitivity in a sub-Saharan African HIV-infected population.	5/8/2020
GCST004115	28062682	Response To Reverse Transcriptase Inhibitor	Nevirapine-Induced Hypersensitivity In Hiv (Stevens-Johnson Syndrome Or Toxic Epidermal Necrosis)	Carr DF 2017	1	Sub-Saharan African|African unspecified	233	106	Genome-wide association study of nevirapine hypersensitivity in a sub-Saharan African HIV-infected population.	5/8/2020
GCST004118	28062682	Response To Reverse Transcriptase Inhibitor	Nevirapine-Induced Hypersensitivity In Hiv	Carr DF 2017	1	Sub-Saharan African	333	122	Genome-wide association study of nevirapine hypersensitivity in a sub-Saharan African HIV-infected population.	5/8/2020
GCST001186	21810746	Response To Reverse Transcriptase Inhibitor	Nevirapine-Induced Rash	Chantarangsu S 2011	NA	South East Asian	149	233	Genome-wide association study identifies variations in 6p21.3 associated with nevirapine-induced rash.	5/9/2020
GCST003792	27671213	Response To Rifampicin	Liver Injury In Anti-Tuberculosis Drug Treatment	Petros Z 2016	0.25	Sub-Saharan African	402	244	Genome-wide association and replication study of anti-tuberculosis drugs-induced liver toxicity.	5/8/2020
GCST004262	28388302	Response To Rifampicin	Liver Injury In Combined Anti-Retroviral And Anti-Tuberculosis Drug-Treated Hiv With Tuberculosis	Petros Z 2017	0.25	African unspecified	186	116	Genome-Wide Association and Replication Study of Hepatotoxicity Induced by Antiretrovirals Alone or with Concomitant Anti-Tuberculosis Drugs.	5/8/2020
GCST002515	24986923	Response To Silica Exposure	Pneumoconiosis In Silica Exposure	Chu M 2014	NA	East Asian	400	1031	A genome-wide association study identifies susceptibility loci of silica-related pneumoconiosis in Han Chinese.	5/8/2020
GCST000213	18650507	Response To Statin	Response To Statin Therapy	Link E 2008	66.536	European	175	16664	SLCO1B1 variants and statin-induced myopathy--a genomewide study.	5/9/2020
GCST001002	21386754	Response To Statin	Cerivastatin-Induced Rhabdomyolysis	Marciante KD 2011	NA	European	917	NA	"Cerivastatin, genetic variants, and the risk of rhabdomyolysis."	5/7/2020
GCST010502	32433338	Response To Tafenoquine	Tafenoquine Efficacy In P. Vivax Malaria (Recurrence By 4 Months)	St Jean PL 2020	0.25	African American or Afro-Caribbean|Asian unspecified|European|Hispanic or Latin American|Native American|Other admixed ancestry	438	NA	Pharmacogenetic assessment of tafenoquine efficacy in patients with Plasmodium vivax malaria.	9/7/2020
GCST010503	32433338	Response To Tafenoquine	Tafenoquine Efficacy In P. Vivax Malaria (Recurrence By 6 Months)	St Jean PL 2020	0.25	African American or Afro-Caribbean|Asian unspecified|European|Hispanic or Latin American|Native American|Other admixed ancestry	438	NA	Pharmacogenetic assessment of tafenoquine efficacy in patients with Plasmodium vivax malaria.	9/7/2020
GCST005804	29278617	Response To Taxane	Taxane-Induced Peripheral Neuropathy In Breast Cancer	Sucheston-Campbell LE 2018	6.6	African American or Afro-Caribbean|European	2274	NA	Genome-wide meta-analyses identifies novel taxane-induced peripheral neuropathy-associated loci.	5/8/2020
GCST005039	29097388	Response To Thiazide	Uncontrolled Blood Pressure In Combination Therapy (Beta Blocker And Thiazide Diuretic)	Magvanjav O 2017	1	European|Hispanic or Latin American	314	414	Genetic Variants Associated With Uncontrolled Blood Pressure on Thiazide Diuretic/β-Blocker Combination Therapy in the PEAR (Pharmacogenomic Evaluation of Antihypertensive Responses) and INVEST (International Verapamil-SR Trandolapril Study) Trials.	5/8/2020
GCST003018	26151496	Response To Thioamide	Thionamide-Induced Agranulocytosis In Graves' Disease	Chen PL 2015	1.75	East Asian	683	567	Genetic determinants of antithyroid drug-induced agranulocytosis by human leukocyte antigen genotyping and genome-wide association study.	5/8/2020
GCST002607	25217962	Response To Thiopurine	Response To Thiopurine Immunosuppressants In Inflammatory Bowel Disease (Pancreatitis) (Azathioprine And Mercaptopurine)	Heap GA 2014	43	European	2207	550	HLA-DQA1-HLA-DRB1 variants confer susceptibility to pancreatitis induced by thiopurine immunosuppressants.	5/8/2020
GCST003603	27558924	Response To Thiopurine	Thiopurine-Induced Leukopenia In Inflammatory Bowel Disease	Kim HS 2016	6.1	East Asian	267	767	A coding variant in FTO confers susceptibility to thiopurine-induced leukopenia in East Asian patients with IBD.	5/8/2020
GCST007229	25108385	Response To Thiopurine	Thiopurine-Induced Early Leukopenia In Crohn's Disease	Yang SK 2014	29.85	East Asian	340	358	A common missense variant in NUDT15 confers susceptibility to thiopurine-induced leukopenia.	5/9/2020
GCST008271	31043678	Response To Tnf Antagonist	Anti-Adalimumab Antibody Production In Response To Treatment In Crohn's Disease	Aterido A 2019	4.95	European	62	88	Genetic association between CD96 locus and immunogenicity to anti-TNF therapy in Crohn's disease.	5/10/2020
GCST008397	31039275	Response To Tnf Antagonist	Infliximab-Induced Mucosal Healing In Crohn's Disease	Park SH 2019	5.3	East Asian	58	54	Association of TRAP1 with Infliximab-Induced Mucosal Healing in Crohn's disease.	5/10/2020
GCST001994	23648065	Response To Topoisomerase Inhibitor	Adverse Response To Chemotherapy (Neutropenia/Leucopenia) (All Topoisomerase Inhibitors)	Low SK 2013	3	East Asian	293	NA	Genome-wide association study of chemotherapeutic agent-induced severe neutropenia/leucopenia for patients in Biobank Japan.	5/8/2020
GCST009381	31597885	Response To Trastuzumab	Trastuzumab-Induced Cardiotoxicity In Cancer	Nakano MH 2019	0.5	East Asian	268	213	A Genome-Wide Association Study Identifies Five Novel Genetic Markers for Trastuzumab-Induced Cardiotoxicity in Japanese Population.	5/10/2020
GCST009980	31969693	Response To Trauma Exposure	Major Depressive Disorder In Trauma Exposed Individuals	Coleman JRI 2020	56.05	European	24094	NA	Genome-wide gene-environment analyses of major depressive disorder and reported lifetime traumatic experiences in UK Biobank.	5/13/2020
GCST009983	31969693	Response To Trauma Exposure	Trauma Exposure In Major Depressive Disorder	Coleman JRI 2020	56.05	European	22880	NA	Genome-wide gene-environment analyses of major depressive disorder and reported lifetime traumatic experiences in UK Biobank.	5/11/2020
GCST009984	31969693	Response To Trauma Exposure	Trauma Exposure In Major Depressive Disorder-Negative Individuals	Coleman JRI 2020	56.05	European	50378	NA	Genome-wide gene-environment analyses of major depressive disorder and reported lifetime traumatic experiences in UK Biobank.	5/11/2020
GCST008270	30999091	Response To Trauma Exposure	Post-Traumatic Stress Disorder Symptoms In Trauma-Exposed Soldiers	Wang Y 2019	1.25	European	2481	NA	Post-traumatic stress following military deployment: Genetic associations and cross-disorder genetic correlations.	5/9/2020
GCST008435	31243853	Response To Vaccine	Response To Hepatitis B Vaccine	Chung S 2019	NA	East Asian	6867	2610	GWAS identifying HLA-DPB1 gene variants associated with responsiveness to hepatitis B virus vaccination in Koreans: Independent association of HLA-DPB1*04:02 possessing rs1042169 G - rs9277355 C - rs9277356 A.	5/8/2020
GCST002297	24282030	Response To Vaccine	Hepatitis B Vaccine Response	Pan L 2013	0.75	East Asian	185	1756	A genome-wide association study identifies polymorphisms in the HLA-DR region associated with non-response to hepatitis B vaccination in Chinese Han populations.	5/8/2020
GCST004270	28437668	Response To Venlafaxine	Venlafaxine Response In Generalised Anxiety Disorder (Responders Vs Non-Responders After 12 Weeks)	Jung J 2017	0.75	European	98	NA	Genome-wide association study of treatment response to venlafaxine XR in generalized anxiety disorder.	5/8/2020
GCST004273	28437668	Response To Venlafaxine	Venlafaxine Response In Generalised Anxiety Disorder (Remitters Vs Non-Remitters After 24 Weeks)	Jung J 2017	0.75	European	98	NA	Genome-wide association study of treatment response to venlafaxine XR in generalized anxiety disorder.	5/8/2020
GCST004274	28437668	Response To Venlafaxine	Venlafaxine Response In Generalised Anxiety Disorder (Remitters Vs Non-Remitters After 12 Weeks)	Jung J 2017	0.75	European	98	NA	Genome-wide association study of treatment response to venlafaxine XR in generalized anxiety disorder.	5/8/2020
GCST004275	28437668	Response To Venlafaxine	Venlafaxine Response In Generalised Anxiety Disorder (Responders Vs Non-Responders After 24 Weeks)	Jung J 2017	0.75	European	98	NA	Genome-wide association study of treatment response to venlafaxine XR in generalized anxiety disorder.	5/8/2020
GCST002792	25710658	Response To Vincristine	Vincristine-Induced Peripheral Neuropathy In Acute Lymphoblastic Leukemia	Diouf B 2015	183.93	European|African unspecified|Asian unspecified|Hispanic or Latin American	321	NA	Association of an inherited genetic variant with vincristine-related peripheral neuropathy in children with acute lymphoblastic leukemia.	5/8/2020
GCST010322	32355309	Response To Zonisamide	Levodopa Wearing Off Effect (Time Symptoms Uncontrolled) In Parkinson's Disease (Response To Zonisamide)	Cha PC 2020	2.25	East Asian	200	NA	Genome-wide association study identifies zonisamide responsive gene in Parkinson's disease patients.	7/24/2020
GCST010323	32355309	Response To Zonisamide	Levodopa Wearing Off Effect (Motor Symptom Score Change) In Parkinson's Disease (Response To Zonisamide)	Cha PC 2020	2.25	East Asian	200	NA	Genome-wide association study identifies zonisamide responsive gene in Parkinson's disease patients.	7/24/2020
GCST000214	18660810	Restless Legs Syndrome	Restless Legs Syndrome	Schormair B 2008	15.35	European	2272	4946	PTPRD (protein tyrosine phosphatase receptor type delta) is associated with restless legs syndrome.	5/7/2020
GCST005042	29029846	Restless Legs Syndrome	Restless Legs Syndrome	Schormair B 2017	230.296	European	110851	317683	Identification of novel risk loci for restless legs syndrome in genome-wide association studies in individuals of European ancestry: a meta-analysis.	5/8/2020
GCST000058	17634447	Restless Legs Syndrome	Restless Legs Syndrome	Stefansson H 2007	20	European	15970	2206	A genetic risk factor for periodic limb movements in sleep.	5/7/2020
GCST000056	17637780	Restless Legs Syndrome	Restless Legs Syndrome	Winkelmann J 2007	21.496	European	2045	2339	Genome-wide association study of restless legs syndrome identifies common variants in three genomic regions.	5/7/2020
